Artist,Title,Album,Date,Lyric,Year,words,negative,neutral,positive,dominant_sentiment,dominant_sentiment_score
Beyoncé,I’d Rather Go Blind,Cadillac Records: Music From the Motion Picture,2008-12-02,something told me it was over yeah when i saw you and her talking deep something deep down in my soul said cry girl cry cry when i saw you and that girl walking around whoo ooh   i would rather i would rather go blind boy then to see you walk away from me child naw naw whoo ooh   so you see i love you so much that i don't wanna watch you leave me baby most of all i just don't i just don't wanna be free now whoo ooh woo oh i was just i was just i was just sitting here thinking of your kiss and your warm embrace yeah when a reflection in a glass that i held to my lips now baby revealed these tears that are on my face whoo ooh   and baby and baby baby i'd rather be blind boy then to see you walk away walk away from me yeah and baby baby baby i'd rather be blind boy then to see you walk away walk away from me,2008.0,"['something', 'told', 'yeah', 'saw', 'talking', 'deep', 'soul', 'said', 'cry', 'girl', 'walking', 'around', 'whoo', 'ooh', 'would', 'rather', 'go', 'blind', 'boy', 'see', 'walk', 'away', 'child', 'naw', 'love', 'much', 'wanna', 'watch', 'leave', 'baby', 'free', 'woo', 'oh', 'sitting', 'thinking', 'kiss', 'warm', 'embrace', 'reflection', 'glass', 'held', 'lip', 'revealed', 'tear', 'face', 'id']",0.122,0.767,0.111,Negative,0.122
Beyoncé,Kitty Kat,B’Day,2006-09-04,you know i hate sleeping alone but you said that you would soon be home but baby that was a long time ago i'm not feelin' it i'm not feelin' it on top of you not callin' me back you see i bet you think it's all on track and you actin' like it's all o' that i'm not feelin' it i'm not feelin' it let's go let's go little kitty cat i think it's time to go let's go little kitty cat he don't want no mo' let's go little kitty cat quite frankly no more givin' it i'm not feelin' it   it's like we at two places but different paces we in trouble but you won't meet me at the  it hurts it feels deserted did you forget where your heart lives  pre what about my body body you don't want my body body acting like i'm not nobody you gon' make me call somebody what about my body body what about my body body you would rather go and party somehow somewhere i'll be naughty   you know i hate sleeping alone but you said that you would soon be home but baby that was a long time ago i'm not feelin' it i'm not feelin' it on top of you not callin' me back you see i bet you think it's all on track and you actin' like it's all o' that i'm not feelin' it i'm not feelin' it let's go let's go little kitty cat i think it's time to go let's go little kitty cat he don't want no mo' let's go little kitty cat quite frankly no more givin' it i'm not feelin' it   let me show you how to get there take a left to compassion lights will be flashin' keep straight and you'll see the sun right there affection you're in the wrong direction if i get caught see it just seems that you don't care  pre what about my body body you don't want my body body acting like i'm not nobody you gon' make me call somebody what about my body body what about my body body you would rather go and party somehow somewhere i'll be naughty   you know i hate sleeping alone but you said that you would soon be home said that you would soon be home but baby that was a long time ago i'm not feelin' it i'm not feelin' it on top of you not calling me back you see i bet you think it's all on track and you actin' like it's all o' that i'm not feeling it i'm not feeling it let's go let's go little kitty cat i think it's time to go he don't want no mo' let's go little kitty cat quite frankly no more givin' it i'm not feelin' it   i'm taking back the things i got from you you and that includes my sweet little nookie too too let's go let's go let's go little kitty cat kitty cat he don't want you anymore no uh uh uh let's go let's go let's go little kitty cat kitty cat he don't want you anymore no ooh ooh   got diamonds on my neck got diamonds on my records since 6 i was coming down reppin' texas how you gon' neglect this you is just a hot mess you can call tyrone you ain't gots to lie craig  pre variation what about my body body what about by my body body i'm in the house all alone you rather go and party what about my body body you don't want my body body acting like i'm nobody you gon' make me call somebody   let's go let's go little kitty cat i think it's time to go let's go little kitty cat he ain't want no mo' let's go little kitty cat no mo' getting' it i'm not feelin' it,2006.0,"['know', 'hate', 'sleeping', 'alone', 'said', 'would', 'soon', 'home', 'baby', 'long', 'time', 'ago', 'im', 'feelin', 'top', 'callin', 'back', 'see', 'bet', 'think', 'track', 'actin', 'like', 'o', 'let', 'go', 'little', 'kitty', 'cat', 'want', 'mo', 'quite', 'frankly', 'givin', 'two', 'place', 'different', 'pace', 'trouble', 'meet', 'hurt', 'feel', 'deserted', 'forget', 'heart', 'life', 'pre', 'body', 'acting', 'nobody', 'gon', 'make', 'call', 'somebody', 'rather', 'party', 'somehow', 'somewhere', 'ill', 'naughty', 'show', 'get', 'take', 'left', 'compassion', 'light', 'flashin', 'keep', 'straight', 'sun', 'right', 'affection', 'wrong', 'direction', 'caught', 'seems', 'care', 'calling', 'feeling', 'taking', 'thing', 'got', 'includes', 'sweet', 'nookie', 'anymore', 'uh', 'ooh', 'diamond', 'neck', 'record', 'since', '6', 'coming', 'reppin', 'texas', 'neglect', 'hot', 'mess', 'tyrone', 'aint', 'gots', 'lie', 'craig', 'variation', 'house', 'getting']",0.085,0.806,0.109,Positive,0.109
Beyoncé,OTHERSIDE,The Lion King: The Gift,2019-07-19,beyoncé if the storm comes if we burn up if the wells run dry you're my reason to believe in another life   beyoncé if it all ends and it's over if the sky falls fire best believe me you will see me on the other side   beyoncé if we wake up lose our patience or even lose our lives oh i'll feel lucky to say that you've been a friend of mine   beyoncé best believe me you will see me on the other side   bankulli  beyoncé sọ kalẹ sọ kalẹ sọ kalẹ wá wá o wá o wá wọnú ọkàn mi lọ olúwa mababu katika mawingu sọ kalẹ mababu katika mawingu olúwa mababu katika mawingu sọ kalẹ mababu katika mawingu olúwa mababu katika mawingu sọ kalẹ mababu katika mawingu olúwa mababu katika mawingu sọ kalẹ mababu katika mawingu oluwa mababu katika mawingu sọ kalẹ mababu katika mawingu,2019.0,"['beyoncé', 'storm', 'come', 'burn', 'well', 'run', 'dry', 'reason', 'believe', 'another', 'life', 'end', 'sky', 'fall', 'fire', 'best', 'see', 'side', 'wake', 'lose', 'patience', 'even', 'oh', 'ill', 'feel', 'lucky', 'say', 'friend', 'mine', 'bankulli', 'sọ', 'kalẹ', 'wá', 'wọnú', 'ọkàn', 'mi', 'lọ', 'olúwa', 'mababu', 'katika', 'mawingu', 'oluwa']",0.049,0.849,0.102,Positive,0.102
Beyoncé,I Care,4,2012-03-23,i told you how you hurt me baby but you don't care now i'm crying and deserted baby but you don't care ain't nobody tell me this is love when you're immune to all my pain i need you to tell me this is love you don't care well that's okay   well i care i know you don't care too much but i still care baby oh i care i know you don't care too much but i still care baby   ever since you knew your power you made me cry and now everytime our love goes sour you won't sympathize you see these tears falling down to my ears i swear you like when i'm in pain yeah i try to tell you all my fears you still don't care that's okay   well i care i know you don't care too much but i still care baby oh i care i know you don't care too much but i still care baby   boy maybe if you cared enough i wouldn't have to care so much what happened to our trust now you're just given up you used to be so in love now you don't care no more  interlude oooh oooh oooh oooh oooh oooh oooh oooh whoa   well i care i know you don't care too much but i still care baby oh i care i know you don't care too much but i still care baby   i still care i still care i still care,2012.0,"['told', 'hurt', 'baby', 'care', 'im', 'cry', 'deserted', 'aint', 'nobody', 'tell', 'love', 'immune', 'pain', 'need', 'well', 'thats', 'okay', 'know', 'much', 'still', 'oh', 'ever', 'since', 'knew', 'power', 'made', 'everytime', 'go', 'sour', 'sympathize', 'see', 'tear', 'falling', 'ear', 'swear', 'like', 'yeah', 'try', 'fear', 'boy', 'maybe', 'cared', 'enough', 'happened', 'trust', 'given', 'used', 'interlude', 'oooh', 'whoa']",0.375,0.489,0.136,Negative,0.375
Beyoncé,Roc,Unreleased Songs ,,oh oh oh i oh oh oh i   if i wrote a book about were we stand then the title of my book would be life with superman that's how you make me feel i count you as a privilege this love is so ideal i'm honored to be in it i know you feel the same i see it everyday in all the things you do in all the things you say   you are my rock baby you're the truth you are my rock i love to rock with you you are my rock you're everything i need you are my rock so baby rock with me i wanna kiss you feel you please you just fine i wanna touch you love you baby all night reward you for all the things you do you are my rock i love to rock with you i love to rock with you  oh oh oh i   if i were to try to count the ways to make me smile i'd run out of fingers before i run out of timeless things to talk about sugar you keeps it going on make me wanna keep my loving strong make me wanna try my best to give you what you want and what you need give you my whole heart not just a little piece more than a minimum i'm talking everything more than a single wish  i'm talking every dream   you are my rock baby you're the truth you are my rock i love to rock with you you are my rock you're everything i need you are my rock so baby rock with me i wanna kiss you feel you please you just fine i wanna touch you love you baby all night reward you for all the things you do you are my rock i love to rock with you i love to rock with you   if there's options i don't want them they're not worth my time cause if it's not you oh no thank you i like us just fine you're a rock in a sand you're a smile in a cry you're my joy through the pain you're the truth through the lies no matter what i do i know that i can count on you  oh oh oh i oh oh oh i,,"['oh', 'wrote', 'book', 'stand', 'title', 'would', 'life', 'superman', 'thats', 'make', 'feel', 'count', 'privilege', 'love', 'ideal', 'im', 'honored', 'know', 'see', 'everyday', 'thing', 'say', 'rock', 'baby', 'truth', 'everything', 'need', 'wanna', 'kiss', 'please', 'fine', 'touch', 'night', 'reward', 'try', 'way', 'smile', 'id', 'run', 'finger', 'timeless', 'talk', 'sugar', 'keep', 'going', 'loving', 'strong', 'best', 'give', 'want', 'whole', 'heart', 'little', 'piece', 'minimum', 'talking', 'single', 'wish', 'every', 'dream', 'there', 'option', 'theyre', 'worth', 'time', 'cause', 'thank', 'like', 'u', 'sand', 'cry', 'joy', 'pain', 'lie', 'matter']",0.025,0.697,0.279,Positive,0.279
Beyoncé,Signs,Dangerously In Love,2003-07-23,beyoncé in december every sign has its own mode i was in love with a sagittarius see the emotions he put me through from capricorns to aquarius they all got their different minds the affection of a virgo which sign matches good with mine   beyoncé i was in love with a sagittarius he blew my mind he also had a flip side too much like a gemini he was freaky like a taurus the way he handled me yeah flirtatious like an aries which sign is best for me   beyoncé capricorn aquarius pisces aries taurus gemini cancer oh leo virgo libra scorpio sagittarius i love all y'all capricorn aquarius pisces aries taurus gemini cancer oh leo virgo libra scorpio sagittarius i love all y'all   beyoncé  missy elliott hey i wish he was a virgo the same sign as me and know how to show me love 'cause i've been hurt by a pisces rewind i wish he was a virgo the same sign as me and know how to show me love 'cause i've been hurt by a pisces i want him sexy like a scorpio the way he holds me close yeah sensitive as a cancer every sign from coast to coast   beyoncé capricorn aquarius pisces aries taurus gemini cancer oh leo virgo libra scorpio sagittarius i love all y'all capricorn aquarius pisces aries taurus gemini cancer oh leo virgo libra scorpio sagittarius i love all y'all   beyoncé i can't explain why i love him bossy like leo's do got game like an aquarius switch moves after he's been with you fun like a libra he stays on my mind he's so unpredictable he reminds me of every sign   beyoncé capricorn aquarius pisces aries taurus gemini cancer oh leo virgo libra scorpio sagittarius i love all y'all capricorn aquarius pisces aries taurus gemini cancer oh leo virgo libra scorpio sagittarius i love all y'all   beyoncé every sign from the first to the last ohh everyday of the month has its good and its bad everyday of the month i love you all all twelve signs capricorn aquarius pisces aries taurus gemini cancer oh capricorn aquarius pisces aries taurus gemini cancer oh capricorn aquarius pisces aries taurus gemini cancer oh    missy elliott every one of these signs you know you blowing me away no matter when you're born for sure with me you okay i love every one of y'all no matter what sign you are january to december here's my open arms   until fade beyoncé i was in love with a sagittarius i was in love with a sagittarius i was in love with a sagittarius i was in love with a sagittarius,2003.0,"['beyoncé', 'december', 'every', 'sign', 'mode', 'love', 'sagittarius', 'see', 'emotion', 'put', 'capricorn', 'aquarius', 'got', 'different', 'mind', 'affection', 'virgo', 'match', 'good', 'mine', 'blew', 'also', 'flip', 'side', 'much', 'like', 'gemini', 'freaky', 'taurus', 'way', 'handled', 'yeah', 'flirtatious', 'aries', 'best', 'pisces', 'cancer', 'oh', 'leo', 'libra', 'scorpio', 'yall', 'missy', 'elliott', 'hey', 'wish', 'know', 'show', 'cause', 'ive', 'hurt', 'rewind', 'want', 'sexy', 'hold', 'close', 'sensitive', 'coast', 'cant', 'explain', 'bossy', 'game', 'switch', 'move', 'he', 'fun', 'stay', 'unpredictable', 'reminds', 'first', 'last', 'ohh', 'everyday', 'month', 'bad', 'twelve', 'one', 'blowing', 'away', 'matter', 'born', 'sure', 'okay', 'january', 'here', 'open', 'arm', 'fade']",0.113,0.65,0.237,Positive,0.237
Beyoncé,FIND YOUR WAY BACK,The Lion King: The Gift,2019-07-19,beyoncé daddy used to take me walkin' down the street daddy used to take my hand say follow me daddy used to lead me back home all the time i got big enough to run around daddy left me outside   beyoncé he said find your way back big big world but you got it baby find your way back don't let this life drive you crazy find your way back come back home 'fore the street lights on find your way back find your way back   beyoncé daddy used to tell me look up at the stars it's been a long time but remember who you are circle of life and one day i might not make it circle of life and one day i might not make it   beyoncé but you just gotta find your way back big big world but you got it baby find your way back don't let this life drive you crazy find your way back come back home 'fore the street lights on find your way back find your way back  refrain beyoncé daddy used to teach me all my moves runnin' 'round wild had to tie my shoes itty bitty child with a smile like you wild wild child look a lot like you daddy used to teach me all my tricks runnin' 'round wild had to get my fix daddy used to teach me all my plays on a marathon have to run my race   beyoncé find your way back big big world but you got it baby find your way back don't let this life drive you crazy find your way back come back home 'fore the street lights on find your way back find your way back yeah   bankulli rikirobo roborebe mamasibo robirebi rebi skindanu dinda dundun sibirobo roborebe oroboskibo robi rebirebi skidin dadun dadun daya  refrain beyoncé daddy used to teach me all my moves runnin' 'round wild had to tie my shoes itty bitty child with a smile like you wild wild child look a lot like you daddy used to teach me all my tricks runnin' 'round wild had to get my fix daddy used to teach me all my plays on a marathon told me run my race   beyoncé find your way back,2019.0,"['beyoncé', 'daddy', 'used', 'take', 'walkin', 'street', 'hand', 'say', 'follow', 'lead', 'back', 'home', 'time', 'got', 'big', 'enough', 'run', 'around', 'left', 'outside', 'said', 'find', 'way', 'world', 'baby', 'let', 'life', 'drive', 'crazy', 'come', 'fore', 'light', 'tell', 'look', 'star', 'long', 'remember', 'circle', 'one', 'day', 'might', 'make', 'gotta', 'refrain', 'teach', 'move', 'runnin', 'round', 'wild', 'tie', 'shoe', 'itty', 'bitty', 'child', 'smile', 'like', 'lot', 'trick', 'get', 'fix', 'play', 'marathon', 'race', 'yeah', 'bankulli', 'rikirobo', 'roborebe', 'mamasibo', 'robirebi', 'rebi', 'skindanu', 'dinda', 'dundun', 'sibirobo', 'oroboskibo', 'robi', 'rebirebi', 'skidin', 'dadun', 'daya', 'told']",0.032,0.893,0.075,Positive,0.075
Beyoncé,End of Time,4,2012-04-23,produced by beyoncé switch  thedream   come take my hand i won't let you go i'll be your friend i will love you so deeply i will be the one to kiss you at night i will love you until the end of time i'll be your baby now promise not to let you go love you like crazy now say you'll never let me go say you'll never let me go say say you'll never let me go hey say you'll never let me go say say you'll never let me go   take you away from here there's nothing between us but space and time i'll be your own little star let me shine in your world in your own little universe make me your girl   come take my hand i won't let you go i'll be your friend i will love you so deeply i will be the one to kiss you at night i will love you until the end of time i'll be your baby now promise not to let you go love you like crazy now say you'll never let me go say you'll never let me go say say you'll never let me go say you'll never let me go say say you'll never let me go   baby come on get up on it show me that you really want it i wanna be the one to love you baby let's go whoa let's go whoa i wanna provide this loving that you're giving i ain't frontin' in this love but can you let me love you from your head to toe whoa baby let's go whoa   boy come to me come to me let me turn your rain into sun come to me baby you don't have to worry baby oh no i promise i'll set your heart free let my love into your soul you go i go we go that's all she wrote  breakdown say you'll say say say you'll nev never say you'll say say say you'll nev never say you'll say say say you'll nev never say you'll say say say you'll nev never can't you see babe say you'll say say say you'll nev never say you'll say say say you'll nev never i just wanna love you say you'll say say say you'll nev never say you'll say say say you'll nev never can't you feel me babe say you'll say say say you'll nev never say you'll say say say you'll nev never i just wanna be with you i just wanna live for you i'll never let you go free your love to me   come take my hand i won't let you go i'll be your friend i will love you so deeply i will be the one to kiss you at night you at night i will love you until the end of time i'll be your baby now promise not to let you go love you like crazy now say you'll never let me go say you'll never let me go say say you'll never let me go say you'll never let me go say say you'll never let me go,2012.0,"['produced', 'beyoncé', 'switch', 'thedream', 'come', 'take', 'hand', 'let', 'go', 'ill', 'friend', 'love', 'deeply', 'one', 'kiss', 'night', 'end', 'time', 'baby', 'promise', 'like', 'crazy', 'say', 'never', 'hey', 'away', 'there', 'nothing', 'u', 'space', 'little', 'star', 'shine', 'world', 'universe', 'make', 'girl', 'get', 'show', 'really', 'want', 'wanna', 'whoa', 'provide', 'loving', 'giving', 'aint', 'frontin', 'head', 'toe', 'boy', 'turn', 'rain', 'sun', 'worry', 'oh', 'set', 'heart', 'free', 'soul', 'thats', 'wrote', 'breakdown', 'nev', 'cant', 'see', 'babe', 'feel', 'live']",0.017,0.743,0.24,Positive,0.24
Beyoncé,Schoolin’ Life,4,2011-06-28,this is for them 0somethings time really moves fast you were just sixteen this is for them 0somethings that didn't turn out exactly how your mom and dad wanted you to be this is for them 40somethings well raise up your glass and laugh like a motherfucker this is for them 50somethings hell you're halfway there baby take it to the head  refrain mom and dad tried to hide the world said the world's just too big for a little girl eyes wide open can't you see i had my first heels by the age of  mom and dad tried to hide the boys i swear that just made 'em want me more at 4 they asked me what i wanna be i said baby  so i get me a drink   i'm not a teacher babe but i can teach you somethin' not a preacher but we can pray if you wanna ain't a doctor but i can make you feel better but im great at writing physical love letters i'm a freak all day all night hot top flight boy i'm out of sight and im crazy all day all night who needs a degree when you're schoolin' life uhoh uhoh whoaohoh uhoh uhoh whoaohoh schoolin life uhoh uhoh whoaohoh uhoh uhoh whoaohoh schoolin life   this is for them pretty somethings living in the fast lane see you when you crash babe this is for them sexy somethings that body ain't gon' always get you out of everything this is for them bitter somethings stop living in regret baby it's not over yet and this is for them chipper somethings that's high on life baby put me on your flight   i'm not a teacher babe but i can teach you somethin' not a preacher but we can pray if you wanna ain't a doctor but i can make you feel better but im great at writing physical love letters i'm a freak all day all night hot top flight boy i'm out of sight and im crazy all day all night who needs a degree when you're schoolin' life uhoh uhoh whoaohoh uhoh uhoh whoaohoh schoolin life uhoh uhoh whoaohoh uhoh uhoh whoaohoh schoolin life   you know it costs to be the boss one day you'll run the town for now make your life what you decide baby party 'til the fire marshals shut this sucks down   i'm not a teacher babe but i can teach you somethin' not a preacher but we can pray if you wanna ain't a doctor but i can make you feel better but im great at writing physical love letters i'm a freak all day all night hot top flight boy i'm out of sight and im crazy all day all night who needs a degree when you're schoolin' life uhoh uhoh whoaohoh who needs a degree when you're schoolin' life uhoh uhoh whoaohoh uhoh uhoh whoaohoh who needs a degree when you're schoolin' life uhoh uhoh whoaohoh   there's not a real way to live this for real just remember to stay relentless oh yeah oh yeah don't stop running until it's finished yeah yeah it's up to you the rest is unwritten hey hey hey,2011.0,"['0somethings', 'time', 'really', 'move', 'fast', 'sixteen', 'turn', 'exactly', 'mom', 'dad', 'wanted', '40somethings', 'well', 'raise', 'glass', 'laugh', 'like', 'motherfucker', '50somethings', 'hell', 'halfway', 'baby', 'take', 'head', 'refrain', 'tried', 'hide', 'world', 'said', 'big', 'little', 'girl', 'eye', 'wide', 'open', 'cant', 'see', 'first', 'heel', 'age', 'boy', 'swear', 'made', 'em', 'want', '4', 'asked', 'wanna', 'get', 'drink', 'im', 'teacher', 'babe', 'teach', 'somethin', 'preacher', 'pray', 'aint', 'doctor', 'make', 'feel', 'better', 'great', 'writing', 'physical', 'love', 'letter', 'freak', 'day', 'night', 'hot', 'top', 'flight', 'sight', 'crazy', 'need', 'degree', 'schoolin', 'life', 'uhoh', 'whoaohoh', 'pretty', 'somethings', 'living', 'lane', 'crash', 'sexy', 'body', 'gon', 'always', 'everything', 'bitter', 'stop', 'regret', 'yet', 'chipper', 'thats', 'high', 'put', 'know', 'cost', 'bos', 'one', 'run', 'town', 'decide', 'party', 'til', 'fire', 'marshal', 'shut', 'suck', 'there', 'real', 'way', 'live', 'remember', 'stay', 'relentless', 'oh', 'yeah', 'running', 'finished', 'rest', 'unwritten', 'hey']",0.084,0.762,0.154,Positive,0.154
