Artist,Title,Album,Date,Lyric,Year,words,negative,neutral,positive,dominant_sentiment,dominant_sentiment_score
Beyoncé,BLACK PARADE (Extended),The Lion King: The Gift [Deluxe Edition],2020-06-19,ah   i'm goin' back to the south i'm goin' back back back back where my roots ain't watered down growin' growin' like a baobab tree of life on fertile ground ancestors put me on game ankh charm on gold chains with my oshun energy oh drip all on me woo ankh or the dashiki print hol' up don't i smell like such a nag champa incense yeah pure ice ice ice ice buss down uh flooded flooded flooded flooded on my wrist out ooh goin' up goin' up motherland motherland drip on me ooh melanin melanin my drip is skin deep like ooh motherland motherland motherland motherland drip on me ooh yeah i can't forget my history is herstory yeah being black maybe that's the reason why they always mad yeah they always mad yeah been past 'em i know that's the reason why they all big mad and they always have been   honey come around my way around my hive whenever mama say so mama say here i come on my throne sittin' high follow my parade oh my parade talkin' slick to my folk my folk nip that lip like lipo lipo you hear them swarmin' right bees is known to bite now here we come on our thrones sittin' high follow my parade oh my parade   yeah yeah i'm for us all black all chrome yeah blackowned yeah black tints yeah matte black yeah yeah roll by my window down let 'em see who in it crack a big smile ding go figure me and jigga fifty 'leven children they like chick how i charge my crystals in a full moon you could send them missiles i'ma send my goons baby sister reppin' yemaya yemaya trust me they gon' need an army ah rubber bullets bouncin' off me ah made a picket sign off your picket fence ah take it as a warning ah ah waist beads from yoruba woo four hunnid billi' mansa musa woo stroll line to the barbeque put us anydamnwhere we gon' make it look cute pandemic fly on the runway in my hazmat judgin' runnin' through the house to my art all black ancestors on the wall let the ghosts chitchat ancestors on the wall let the ghosts chitchat hold my hands we gon' pray together lay down face down in the gravel woo wearin' all attire white to the funeral black love we gon' stay together curtis mayfield on the speaker woo lil' malcolm martin mixed with mama tina woo need another march lemme call tamika woo need peace and reparation for my people woo fuck these laid edges i'ma let it shrivel up shrivel up fuck this fade and waves i'ma let it dread all up dread all up put your fists up in the air show black love show black love motherland drip on me motherland motherland drip on me   honey come around my way around my hive whenever mama say so mama say here i come on my throne sittin' high follow my parade oh my parade talkin' slick to my folk my folk nip that lip like lipo lipo hear 'em swarmin' right zz bees is known to bite zz zz now here we come on our thrones sittin' high follow my parade oh my parade   we got rhythm we got rhythm we got pride we got pride we birth kings we birth kings we birth tribes we birth tribes holy river holy river holy tongue holy tongue speak the glory speak the glory feel the love feel the love motherland motherland drip on me hey hey hey motherland motherland drip on me hey hey hey i can't forget my history it's herstory motherland drip on me motherland motherland drip on me woo woo  refrain being black maybe that's the reason why they always mad yeah they always mad yeah been past 'em i know that's the reason why they all big mad and they always have been   honey come around my way around my hive my whenever mama say so hey mama say hey hey here i come on my throne sittin' high high follow my parade oh my parade hey hey hey talkin' slick to my folk my folk nip that lip like lipo lipo hear 'em swarmin' right zz bees is known to bite zz zz now here we come on our thrones sittin' high follow my parade oh black parade,2020.0,"['ah', 'im', 'goin', 'back', 'south', 'root', 'aint', 'watered', 'growin', 'like', 'baobab', 'tree', 'life', 'fertile', 'ground', 'ancestor', 'put', 'game', 'ankh', 'charm', 'gold', 'chain', 'oshun', 'energy', 'oh', 'drip', 'woo', 'dashiki', 'print', 'hol', 'smell', 'nag', 'champa', 'incense', 'yeah', 'pure', 'ice', 'bus', 'uh', 'flooded', 'wrist', 'ooh', 'motherland', 'melanin', 'skin', 'deep', 'cant', 'forget', 'history', 'herstory', 'black', 'maybe', 'thats', 'reason', 'always', 'mad', 'past', 'em', 'know', 'big', 'honey', 'come', 'around', 'way', 'hive', 'whenever', 'mama', 'say', 'throne', 'sittin', 'high', 'follow', 'parade', 'talkin', 'slick', 'folk', 'nip', 'lip', 'lipo', 'hear', 'swarmin', 'right', 'bee', 'known', 'bite', 'u', 'chrome', 'blackowned', 'tint', 'matte', 'roll', 'window', 'let', 'see', 'crack', 'smile', 'ding', 'go', 'figure', 'jigga', 'fifty', 'leven', 'child', 'chick', 'charge', 'crystal', 'full', 'moon', 'could', 'send', 'missile', 'ima', 'goon', 'baby', 'sister', 'reppin', 'yemaya', 'trust', 'gon', 'need', 'army', 'rubber', 'bullet', 'bouncin', 'made', 'picket', 'sign', 'fence', 'take', 'warning', 'waist', 'bead', 'yoruba', 'four', 'hunnid', 'billi', 'mansa', 'musa', 'stroll', 'line', 'barbeque', 'anydamnwhere', 'make', 'look', 'cute', 'pandemic', 'fly', 'runway', 'hazmat', 'judgin', 'runnin', 'house', 'art', 'wall', 'ghost', 'chitchat', 'hold', 'hand', 'pray', 'together', 'lay', 'face', 'gravel', 'wearin', 'attire', 'white', 'funeral', 'love', 'stay', 'curtis', 'mayfield', 'speaker', 'lil', 'malcolm', 'martin', 'mixed', 'tina', 'another', 'march', 'lemme', 'call', 'tamika', 'peace', 'reparation', 'people', 'fuck', 'laid', 'edge', 'shrivel', 'fade', 'wave', 'dread', 'fist', 'air', 'show', 'zz', 'got', 'rhythm', 'pride', 'birth', 'king', 'tribe', 'holy', 'river', 'tongue', 'speak', 'glory', 'feel', 'hey', 'refrain']",0.049,0.789,0.161,Positive,0.161
Beyoncé,Daddy,Dangerously In Love,2003-07-23,i remember when you use to take me on a bike ride everyday on the bayou you remember that we were inseparable and i remember when you could do no wrong you'd come home from work and i jumped in your arms when i saw you i was so happy to see you i was so excited so happy to see you   because you loved me i overcome yeah and i'm so proud of what you've become you've given me such security no matter what mistakes i know you're there for me you cure my disappointments and you heal my pain you understood my fears and you protected me treasure every irreplaceable memory and that's why i want my unborn son to be like my daddy i want my husband to be like my daddy there is no one else like my daddy and i thank you for loving me daddy daddy daddy   i still remember the expression on your face when you found out i'd been on a date and had a boyfriend my first boyfriend you should've seen your face i still remember i caught you crying cause of my tattoo could have said beyoncé i told you so instead you said you'd get one too even my mama said y'all get one just like mine   words can't express my boundless gratitude for you i appreciate what you do you've given me such security no matter what mistakes i know you're there for me you cure my disappointments and you heal my pain you understand my fears and you protected me treasure every extraordinary memory and that's why i want my unborn son to be like my daddy i want my husband to be like my daddy there is no one else like my daddy and i thank you for loving me   even if my man broke my heart today no matter how much pain i'm in i will be okay 'cause i got a man in my life that can't be replaced for this love is unconditional it won't go away i know i'm lucky know it ain't easy for men who take care of their responsibilities   love is overwhelming lord why did you pick me can't stop my tears from falling i love you so much daddy   thank you you've done so much for me i love you daddy i get so emotional daddy every time i think of you i get so emotional daddy every time i think of you there is no one else like my daddy no one else replace my daddy,2003.0,"['remember', 'use', 'take', 'bike', 'ride', 'everyday', 'bayou', 'inseparable', 'could', 'wrong', 'come', 'home', 'work', 'jumped', 'arm', 'saw', 'happy', 'see', 'excited', 'loved', 'overcome', 'yeah', 'im', 'proud', 'become', 'given', 'security', 'matter', 'mistake', 'know', 'cure', 'disappointment', 'heal', 'pain', 'understood', 'fear', 'protected', 'treasure', 'every', 'irreplaceable', 'memory', 'thats', 'want', 'unborn', 'son', 'like', 'daddy', 'husband', 'one', 'else', 'thank', 'loving', 'still', 'expression', 'face', 'found', 'id', 'date', 'boyfriend', 'first', 'seen', 'caught', 'cry', 'cause', 'tattoo', 'said', 'beyoncé', 'told', 'instead', 'get', 'even', 'mama', 'yall', 'mine', 'word', 'cant', 'express', 'boundless', 'gratitude', 'appreciate', 'understand', 'extraordinary', 'man', 'broke', 'heart', 'today', 'much', 'okay', 'got', 'life', 'replaced', 'love', 'unconditional', 'go', 'away', 'lucky', 'aint', 'easy', 'men', 'care', 'responsibility', 'overwhelming', 'lord', 'pick', 'stop', 'tear', 'falling', 'done', 'emotional', 'time', 'think', 'replace']",0.112,0.646,0.242,Positive,0.242
Beyoncé,Rise Up,Epic (Original Motion Picture Soundtrack),,i'm the matriarch of your land when you need to take my hand come into my arms i'll keep you safe from harm i'll keep your precious heart   some people try to drag you down take it from me stand and be proud you're a warrior you're my warrior  prehook be who you are be who you are know that life holds more than what you see rise up little man rise up little man  hook fight for you and me look into my eyes and believe little woman we will fight we will fight little woman we will fight we will rise i see you and me take my hand and we we will stand we will fight we will fight we will stand and together we will rise   they'll burn you at the stake if you don't act like they want you to but baby be yourself do good and help the world  prehook  hook  4 rise up rise up little man don't be scared i'm holding your hand know that life holds more than what we see and what we get  5 rise up rise up little woman don't be afraid to risk it all know that life holds more than what we see and what we get i will  hook,,"['im', 'matriarch', 'land', 'need', 'take', 'hand', 'come', 'arm', 'ill', 'keep', 'safe', 'harm', 'precious', 'heart', 'people', 'try', 'drag', 'stand', 'proud', 'warrior', 'prehook', 'know', 'life', 'hold', 'see', 'rise', 'little', 'man', 'hook', 'fight', 'look', 'eye', 'believe', 'woman', 'together', 'theyll', 'burn', 'stake', 'act', 'like', 'want', 'baby', 'good', 'help', 'world', '4', 'scared', 'holding', 'get', '5', 'afraid', 'risk']",0.077,0.81,0.114,Positive,0.114
Beyoncé,That’s Why You’re Beautiful,I Am... Sasha Fierce,2008-11-18,diamonds used to be coal look young 'cause they got soul that's why they're beautiful and my heart used to be cold 'til your hands laid on my soul baby that's why you're beautiful   i'm not wondering why the sky's blue that's not my business all i know is i look up and tell myself be patient love that could be us   lovers used to make love and died just to give us their piece of the beautiful remember when we made love love wasn't it beautiful   don't ask me why the sky's blue that's not my business all i know is i look up and tell myself be patient love that could be us   diamonds used to be coal be coal look young 'cause they got soul got soul and my heart used to be cold be cold 'til your hands laid on my soul somebody's got to stay deep in love that could be you that's why we're beautiful that's why you're beautiful ooh   why why that's why you're beautiful that's why you're beautiful that's why you're beautiful,2008.0,"['diamond', 'used', 'coal', 'look', 'young', 'cause', 'got', 'soul', 'thats', 'theyre', 'beautiful', 'heart', 'cold', 'til', 'hand', 'laid', 'baby', 'im', 'wondering', 'sky', 'blue', 'business', 'know', 'tell', 'patient', 'love', 'could', 'u', 'lover', 'make', 'died', 'give', 'piece', 'remember', 'made', 'ask', 'somebody', 'stay', 'deep', 'were', 'ooh']",0.016,0.703,0.281,Positive,0.281
Beyoncé,Video Phone,I Am... Sasha Fierce,2009-11-17,shawty whatcha name is  pre them hustlas keep on talkin' they like the way i'm walkin' you saying that you want me so press record ill let you film me   on your video phone make a cameo tape me on your video phone i can handle you watch me on your video phone on your video video if you want me you can watch me on your video phone   i love how you approach me fresh white with your pants hanging grown man low everything you sayin' soundin good to me no need to convince me anymore swagger it's right one blade is tight and i smell your cologne in the air baby you doin' somethin' right you just cancelled every other man here you say you love my bag and the color of my nails you can see that i got it goin' on i wanna make sure you remember me so i'm gon' leave my number on your video phone i got no time for frontin' i know just what im wantin' if it's gonna be you and me when i call they better see me on your video screen  pre them hustlas keep on talkin' they like the way i'm walkin' you saying that you want me so press record ill let you film me   on your video phone make a cameo tape me on your video phone i can handle you watch me on your video phone on your video video if you want me you can watch me on your video phone   you a cutie you should let me put you in my movies do shoot into a star of your own hit song we can shoot the video right here on my cellphone i never seen a smile so pretty i need to know i'll always have you wit' me so take your picture on my video phone you can pick your own song and you could be the only one i know you like that turn you into a star i got it like that like that baby don't fight it 'cause when i miss your call i hit you right back on my video phone  pre them hustlas keep on talkin' they like the way i'm walkin' you saying that you want me so press record ill let you film me   on your video phone make a cameo tape me on your video phone i can handle you watch me on your video phone on your video video if you want me you can watch me on your video phone   you know them g's they be hollerin' 'specially them hot ones brooklyn atlanta houston to new orleans when they see me they be like yo b let me call you you breakin' my focus boy you cute and you ballin' you like it when i shake it shawty on a mission what your name is what you want me naked if you likin' this position you can tape it on your video phone hustla keep on talkin' you like the way it's poppin' you sayin' that you want me press record and baby film me   on your video phone make a cameo tape me on your video phone i can handle you watch me on your video phone on your video video if you want me you can watch me on your video phone,2009.0,"['shawty', 'whatcha', 'name', 'pre', 'hustlas', 'keep', 'talkin', 'like', 'way', 'im', 'walkin', 'saying', 'want', 'press', 'record', 'ill', 'let', 'film', 'video', 'phone', 'make', 'cameo', 'tape', 'handle', 'watch', 'love', 'approach', 'fresh', 'white', 'pant', 'hanging', 'grown', 'man', 'low', 'everything', 'sayin', 'soundin', 'good', 'need', 'convince', 'anymore', 'swagger', 'right', 'one', 'blade', 'tight', 'smell', 'cologne', 'air', 'baby', 'doin', 'somethin', 'cancelled', 'every', 'say', 'bag', 'color', 'nail', 'see', 'got', 'goin', 'wanna', 'sure', 'remember', 'gon', 'leave', 'number', 'time', 'frontin', 'know', 'wantin', 'gonna', 'call', 'better', 'screen', 'cutie', 'put', 'movie', 'shoot', 'star', 'hit', 'song', 'cellphone', 'never', 'seen', 'smile', 'pretty', 'always', 'wit', 'take', 'picture', 'pick', 'could', 'turn', 'fight', 'cause', 'miss', 'back', 'g', 'hollerin', 'specially', 'hot', 'brooklyn', 'atlanta', 'houston', 'new', 'orleans', 'yo', 'b', 'breakin', 'focus', 'boy', 'cute', 'ballin', 'shake', 'mission', 'naked', 'likin', 'position', 'hustla', 'poppin']",0.05,0.834,0.116,Positive,0.116
Beyoncé,All I Could Do Was Cry,Cadillac Records: Music From the Motion Picture,2008-12-02,i heard church bells ringing i heard a choir singing i saw my love walk down the aisle on her finger he placed a ring  oooh oh  i saw them holding hands she was standing there wwith my man i heard them promise til death do us part each word was a pain in my heart  all i could do all i could do was cry all i could do was cry i was losing the man that i love and all i could do was cry  and now the wedding is over the rice rice has been thrown over their heads for them life has just begun but mine is ending  ooh  all i could do all i could do was cry all i could do was cry i was losing the man that i love and all i could do was cry,2008.0,"['heard', 'church', 'bell', 'ringing', 'choir', 'singing', 'saw', 'love', 'walk', 'aisle', 'finger', 'placed', 'ring', 'oooh', 'oh', 'holding', 'hand', 'standing', 'wwith', 'man', 'promise', 'til', 'death', 'u', 'part', 'word', 'pain', 'heart', 'could', 'cry', 'losing', 'wedding', 'rice', 'thrown', 'head', 'life', 'begun', 'mine', 'ending', 'ooh']",0.188,0.728,0.084,Negative,0.188
Beyoncé,Lay Up Under Me,4,2011-06-24,don't you worry 'bout a club just come and lay up under me tonight   i was out shopping thinking of something i should get you cause i've been gone so many weeks damn i miss you don't wanna do nothing more than just stare at your face and let you know i'm happy you're my best friend part of this fortune boy i owe you for being always there to talk to take some time out starting with today for my babe   we're gonna hit the floor at home we'll let the candles be your light tonight and i'ma dj all of your songs you ain't got to worry 'bout a club just come and lay up under me tonight tonight tonight tonight tonight tonight tonight tonight tonight tonight don't you worry 'bout a club just come and lay up under me tonight   let's pop a bottle of the vintage that i bought you i'll model sexy pictures right on top of you ten years together still feels like we're making love for the first time like i'm in highschool sneaking with my boyfriend all of this fortune boy i owe you for being always here to talk to taking time out starting with today for my babe   we're gonna hit the floor at home we'll let the candles be your light tonight and i'ma dj all of your songs you ain't got to worry 'bout a club just come and lay up under me tonight tonight tonight tonight tonight tonight tonight tonight tonight tonight don't you worry 'bout a club just come and lay up under me tonight   boy if you just call i'm on my way when it comes to my baby i bring my best i just wanna party tonight 'cause it's obvious to see that you're all i wanna be uh just let me look at you uh you look so sexy boy i wanna taste all unwrapped and on it's way when i groove with you oh you'll feel so good boy you're my favorite place just come and lay up under me   we're gonna hit the floor at home we'll let the candles be your light tonight and i'ma dj all of your songs you ain't got to worry 'bout a club just come and lay up under me tonight tonight tonight tonight tonight tonight tonight tonight tonight tonight don't you worry 'bout a club just come and lay up under me tonight,2011.0,"['worry', 'bout', 'club', 'come', 'lay', 'tonight', 'shopping', 'thinking', 'something', 'get', 'cause', 'ive', 'gone', 'many', 'week', 'damn', 'miss', 'wanna', 'nothing', 'stare', 'face', 'let', 'know', 'im', 'happy', 'best', 'friend', 'part', 'fortune', 'boy', 'owe', 'always', 'talk', 'take', 'time', 'starting', 'today', 'babe', 'were', 'gonna', 'hit', 'floor', 'home', 'well', 'candle', 'light', 'ima', 'dj', 'song', 'aint', 'got', 'pop', 'bottle', 'vintage', 'bought', 'ill', 'model', 'sexy', 'picture', 'right', 'top', 'ten', 'year', 'together', 'still', 'feel', 'like', 'making', 'love', 'first', 'highschool', 'sneaking', 'boyfriend', 'taking', 'call', 'way', 'baby', 'bring', 'party', 'obvious', 'see', 'uh', 'look', 'taste', 'unwrapped', 'groove', 'oh', 'good', 'favorite', 'place']",0.011,0.852,0.137,Positive,0.137
Beyoncé,Ghost,Unreleased Songs ,,verse and i've been drifting off on knowledge catcalls on catwalks man these women getting solemn i could sing a song for a mon or salamander we took a flight at midnight and now my mind can't help but wonder how come spoonfed pluralized eyes to find the beaches in the forest when i'm looking off the edge i preach my gut it can't help but ignore it i'm climbing up the walls cause all the shit i hear is boring all the shit i do is boring all these record labels boring i don't trust these record labels i'm torn all these people on the planet working 9 to 5 just to stay alive the 9 to 5 just to stay alive the 9 to 5 just to stay alive the 9 to 5 just to stay alive the 9 to 5 just to stay alive the 9 to 5 just to stay alive the 9 to 5 just to stay alive all the people on the planet working 9 to 5 just to stay alive how come  hook what goes up ghost around ghost around around around around what goes up ghost around ghost around around around around what goes up ghost around ghost around around around around   around around around around around around around around around around around around around around around around around around around around around   soul not for sale probably won't make no money off this oh well reap what you sow perfection is so mmm,,"['verse', 'ive', 'drifting', 'knowledge', 'catcall', 'catwalk', 'man', 'woman', 'getting', 'solemn', 'could', 'sing', 'song', 'mon', 'salamander', 'took', 'flight', 'midnight', 'mind', 'cant', 'help', 'wonder', 'come', 'spoonfed', 'pluralized', 'eye', 'find', 'beach', 'forest', 'im', 'looking', 'edge', 'preach', 'gut', 'ignore', 'climbing', 'wall', 'cause', 'shit', 'hear', 'boring', 'record', 'label', 'trust', 'torn', 'people', 'planet', 'working', '9', '5', 'stay', 'alive', 'hook', 'go', 'ghost', 'around', 'soul', 'sale', 'probably', 'make', 'money', 'oh', 'well', 'reap', 'sow', 'perfection', 'mmm']",0.132,0.692,0.176,Positive,0.176
Beyoncé,God Made You Beautiful,,,when you were born the angels sighed in delight they never thought they'd see such a beautiful sight you took the breath and the world was right again tears were shed how we had been blessed  prehook and your love it shines so bright you bring me back to life back to life you make everything right oh and your love it shines so bright you bring me back to life back to life you got a light inside light inside  hook god made you beautiful beautiful beautiful god made you beautiful beautiful you're beautiful   well look at me you were brought into my life i kiss those little feet and watch for your perfect smile and when it comes the world stops in your eyes i found love i found peace of the purest kind  prehook and your love it shines so bright you bring me back to life back to life you make everything right oh and your love it shines so bright you bring me back to life back to life you got a light inside light inside  hook god made you beautiful beautiful beautiful god made you beautiful beautiful you're beautiful  break thank god i get on my knees and pray thank god for giving me a life you're beautiful you're beautiful too beautiful god made you beautiful  hook god made you beautiful beautiful beautiful god made you beautiful beautiful you're beautiful,,"['born', 'angel', 'sighed', 'delight', 'never', 'thought', 'theyd', 'see', 'beautiful', 'sight', 'took', 'breath', 'world', 'right', 'tear', 'shed', 'blessed', 'prehook', 'love', 'shine', 'bright', 'bring', 'back', 'life', 'make', 'everything', 'oh', 'got', 'light', 'inside', 'hook', 'god', 'made', 'well', 'look', 'brought', 'kiss', 'little', 'foot', 'watch', 'perfect', 'smile', 'come', 'stop', 'eye', 'found', 'peace', 'purest', 'kind', 'break', 'thank', 'get', 'knee', 'pray', 'giving']",0.01,0.485,0.505,Positive,0.505
