Artist,Title,Album,Date,Lyric,Year,words,negative,neutral,positive,dominant_sentiment,dominant_sentiment_score
Beyoncé,Drunk in Love,BEYONCÉ,2013-12-17,beyoncé i've been drinkin' i've been drinkin' i get filthy when that liquor get into me i've been thinkin' i've been thinkin' why can't i keep my fingers off it baby i want you nownow why can't i keep my fingers off you baby i want you na na cigars on ice cigars on ice feelin' like an animal with these cameras all in my grill flashin' lights flashin' lights you got me faded faded faded baby i want you na na can't keep your eyes off my fatty daddy i want you na na drunk in love i want you  pre beyoncé we woke up in the kitchen saying how the hell did this shit happen oh baby drunk in love we be all night last thing i remember is our beautiful bodies grindin' up in that club drunk in love   beyoncé we be all night love love we be all night love love   beyoncé we be all night and everything all right no complaints from my body so fluorescent under these lights boy i'm drinkin' park it in my lot 7 i'm rubbin' on it rubrubbin' if you scared call that reverend boy i'm drinkin' get my brain right armand de brignac gangster wife louis sheets he sweat it out like washrags he wet it up boy i'm drinkin' i'm singin' on the mic to my boy toys then i fill the tub up halfway then ride it with my surfboard surfboard surfboard grainin' on that wood grainin'grainin' on that wood i'm swervin' on that swervin'swervin' on that big body been servin' all this swerve surfin' all in this goodgood hahaha  pre beyoncé we woke up in the kitchen saying how the hell did this shit happen oh baby drunk in love we be all night last thing i remember is our beautiful bodies grindin' up in that club drunk in love   beyoncé  jayz we be all night love love we be all night love love i'm nice right now hold up   jayz that d'ussé is the shit if i do say so myself if i do say so myself if i do say so myself hold up stumble all in the house time to back up all of that mouth that you had all in the car talkin' 'bout you the baddest bitch thus far talkin' 'bout you be reppin' that third i wanna see all that shit that i heard know i sling clint eastwood hope you can handle this curve uh foreplay in a foyer fucked up my warhol slid the panties right to the side ain't got the time to take drawers off on sight catch a charge i might beat the box up like mike in '97 i bite i'm ike turner turn up baby no i don't play now eat the cake anna mae said eat the cake anna mae i'm nice for y'all to reach these heights you gon' need g 4 5 6 flights sleep tight we sex again in the morning your breasteses is my breakfast we goin' in we be all night   beyoncé we be all night love love we be all night love love   beyoncé i'm never tired never tired i been sippin' that's the only thing that's keepin' me on fire we on fire didn't mean to spill that liquor all on my attire i've been drinkin' watermelon i want your body right here daddy i want you right now can't keep your eyes off my fatty daddy i want you   beyoncé we be all night love love we be all night love love  produced by noah detail fisher beyoncé knowles timbaland jerome harmon boots and andre proctor,2013.0,"['beyoncé', 'ive', 'drinkin', 'get', 'filthy', 'liquor', 'thinkin', 'cant', 'keep', 'finger', 'baby', 'want', 'nownow', 'na', 'cigar', 'ice', 'feelin', 'like', 'animal', 'camera', 'grill', 'flashin', 'light', 'got', 'faded', 'eye', 'fatty', 'daddy', 'drunk', 'love', 'pre', 'woke', 'kitchen', 'saying', 'hell', 'shit', 'happen', 'oh', 'night', 'last', 'thing', 'remember', 'beautiful', 'body', 'grindin', 'club', 'everything', 'right', 'complaint', 'fluorescent', 'boy', 'im', 'park', 'lot', '7', 'rubbin', 'rubrubbin', 'scared', 'call', 'reverend', 'brain', 'armand', 'de', 'brignac', 'gangster', 'wife', 'louis', 'sheet', 'sweat', 'washrag', 'wet', 'singin', 'mic', 'toy', 'fill', 'tub', 'halfway', 'ride', 'surfboard', 'grainin', 'wood', 'grainingrainin', 'swervin', 'swervinswervin', 'big', 'servin', 'swerve', 'surfin', 'goodgood', 'hahaha', 'jayz', 'nice', 'hold', 'dussé', 'say', 'stumble', 'house', 'time', 'back', 'mouth', 'car', 'talkin', 'bout', 'baddest', 'bitch', 'thus', 'far', 'reppin', 'third', 'wanna', 'see', 'heard', 'know', 'sling', 'clint', 'eastwood', 'hope', 'handle', 'curve', 'uh', 'foreplay', 'foyer', 'fucked', 'warhol', 'slid', 'panty', 'side', 'aint', 'take', 'drawer', 'sight', 'catch', 'charge', 'might', 'beat', 'box', 'mike', '97', 'bite', 'ike', 'turner', 'turn', 'play', 'eat', 'cake', 'anna', 'mae', 'said', 'yall', 'reach', 'height', 'gon', 'need', 'g', '4', '5', '6', 'flight', 'sleep', 'tight', 'sex', 'morning', 'breasteses', 'breakfast', 'goin', 'never', 'tired', 'sippin', 'thats', 'keepin', 'fire', 'mean', 'spill', 'attire', 'watermelon', 'produced', 'noah', 'detail', 'fisher', 'knowles', 'timbaland', 'jerome', 'harmon', 'boot', 'andre', 'proctor']",0.085,0.73,0.185,Positive,0.185
Beyoncé,Formation,Lemonade,2016-02-06,messy mya what happened at the new wil'ins bitch i'm back by popular demand  refrain beyoncé y'all haters corny with that illuminati mess paparazzi catch my fly and my cocky fresh i'm so reckless when i rock my givenchy dress stylin' i'm so possessive so i rock his roc necklaces my daddy alabama momma louisiana you mix that negro with that creole make a texas bama i like my baby heir with baby hair and afros i like my negro nose with jackson five nostrils earned all this money but they never take the country out me i got hot sauce in my bag swag  interlude messy mya  big freedia oh yeah baby oh yeah i oh oh yes i like that i did not come to play with you hoes haha i came to slay bitch i like cornbreads and collard greens bitch oh yes you besta believe it  refrain beyoncé y'all haters corny with that lluminati mess paparazzi catch my fly and my cocky fresh i'm so reckless when i rock my givenchy dress stylin' i'm so possessive so i rock his roc necklaces my daddy alabama momma louisiana you mix that negro with that creole make a texas bama i like my baby heir with baby hair and afros i like my negro nose with jackson five nostrils earned all this money but they never take the country out me i got hot sauce in my bag swag   beyoncé i see it i want it i stunt yellow boneit i dream it i work hard i grind 'til i own it i twirl on them haters albino alligators el camino with the seat low sippin' cuervo with no chaser sometimes i go off i go off i go hard i go hard get what's mine take what's mine i'm a star i'm a star 'cause i slay slay i slay hey i slay okay i slay okay all day okay i slay okay i slay okay i slay okay we gon' slay slay gon' slay okay we slay okay i slay okay i slay okay okay okay i slay okay okay okay okay okay okay okay ladies now let's get in formation 'cause i slay okay ladies now let's get in formation 'cause i slay prove to me you got some coordination 'cause i slay slay trick or you get eliminated  verse beyoncé when he fuck me good i take his ass to red lobster 'cause i slay when he fuck me good i take his ass to red lobster we gon slay if he hit it right i might take him on a flight on my chopper i slay drop him off at the mall let him buy some j's let him shop up 'cause i slay i might get your song played on the radio station 'cause i slay i might get your song played on the radio station 'cause i slay you just might be a black bill gates in the making 'cause i slay i just might be a black bill gates in the making   beyoncé i see it i want it i stunt yellow boneit i dream it i work hard i grind 'til i own it i twirl on my haters albino alligators el camino with the seat low sippin' cuervo with no chaser sometimes i go off i go off i go hard i go hard take what's mine take what's mine i'm a star i'm a star 'cause i slay slay i slay hey i slay okay i slay okay i slay okay i slay okay i slay okay i slay okay we gon' slay slay gon' slay okay we slay okay i slay okay i slay okay okay okay i slay okay okay okay okay okay okay okay ladies now let's get in formation i slay okay ladies now let's get in formation 'cause i slay prove to me you got some coordination 'cause i slay slay trick or you get eliminated i slay   beyoncé okay ladies now let's get in formation i slay okay ladies now let's get in formation you know you that bitch when you cause all this conversation always stay gracious best revenge is your paper   girl i hear some thunder golly look at that water boy oh lord,2016.0,"['messy', 'mya', 'happened', 'new', 'wilins', 'bitch', 'im', 'back', 'popular', 'demand', 'refrain', 'beyoncé', 'yall', 'hater', 'corny', 'illuminati', 'mess', 'paparazzo', 'catch', 'fly', 'cocky', 'fresh', 'reckless', 'rock', 'givenchy', 'dress', 'stylin', 'possessive', 'roc', 'necklace', 'daddy', 'alabama', 'momma', 'louisiana', 'mix', 'negro', 'creole', 'make', 'texas', 'bama', 'like', 'baby', 'heir', 'hair', 'afro', 'nose', 'jackson', 'five', 'nostril', 'earned', 'money', 'never', 'take', 'country', 'got', 'hot', 'sauce', 'bag', 'swag', 'interlude', 'big', 'freedia', 'oh', 'yeah', 'yes', 'come', 'play', 'hoe', 'haha', 'came', 'slay', 'cornbread', 'collard', 'green', 'besta', 'believe', 'lluminati', 'see', 'want', 'stunt', 'yellow', 'boneit', 'dream', 'work', 'hard', 'grind', 'til', 'twirl', 'albino', 'alligator', 'el', 'camino', 'seat', 'low', 'sippin', 'cuervo', 'chaser', 'sometimes', 'go', 'get', 'whats', 'mine', 'star', 'cause', 'hey', 'okay', 'day', 'gon', 'lady', 'let', 'formation', 'prove', 'coordination', 'trick', 'eliminated', 'verse', 'fuck', 'good', 'as', 'red', 'lobster', 'hit', 'right', 'might', 'flight', 'chopper', 'drop', 'mall', 'buy', 'j', 'shop', 'song', 'played', 'radio', 'station', 'black', 'bill', 'gate', 'making', 'know', 'conversation', 'always', 'stay', 'gracious', 'best', 'revenge', 'paper', 'girl', 'hear', 'thunder', 'golly', 'look', 'water', 'boy', 'lord']",0.136,0.651,0.212,Positive,0.212
Beyoncé,Partition,BEYONCÉ,2013-12-13,part  yoncé   let me hear you say hey ms carter hey ms carter say hey ms carter hey ms carter give me some   see me up in the club with fifty'leven girls posted in the back diamond fangs in my grill brooklyn brim with my eyes sitting low every boy in here with me got that smoke every girl in here got to look me up and down all on instagram cake by the pound circulate the image every time i come around g's up tell me how i'm looking babe   boy this all for you just walk my way just tell me how it's looking babe just tell me how it's looking babe how it's looking babe i do this all for you baby just take aim and tell me how it's looking babe how it's looking babe tell me how it's looking babe looking babe   drop the bass mane the bass get lower radio say speed it up i just go slower high like treble pumping on the mids ya man ain't ever seen a booty like this and why you think ya keep my name rolling off the tongue 'cause when he wanna smash i'll just write another one i sneezed on the beat and the beat got sicker yoncé all on his mouth like liquor  hook yoncé all on his mouth like liquor yoncé all on his mouth like liquor yoncé all on his mouth like liquor like like liquor like like like liquor yoncé all on his mouth like liquor yoncé all on his mouth like liquor yoncé all on his mouth like liquor like like liquor like like like liquor   beyoncé beyoncé are you happy to be in paris are you happy to be in paris beyoncé beyoncé beyoncé  part  partition   driver roll up the partition please   driver roll up the partition please i don't need you seeing 'yoncé on her knees took fortyfive minutes to get all dressed up we ain't even gonna make it to this club now my mascara running red lipstick smudged oh he so horny yeah he want to fuck he popped all my buttons and he ripped my blouse he monica lewinsky'd all on my gown  pre oh there daddy daddy didnt bring the towel oh baby baby we better slow it down took fortyfive minutes to get all dressed up we ain't even gon' make it to this club   take all of me i just wanna be the girl you like girl you like the kind of girl you like girl you like take all of me i just wanna be the girl you like girl you like the kinda girl you like is right here with me right here with me right here with me right here with me   driver roll up the partition fast hey driver roll up the partition fast over there i swear i saw them cameras flash handprints and footprints on my glass handprints and good grips all on my ass private show with the music blasting he like to call me peaches when we get this nasty red wine drip well talk that trash chauffeur eavesdropping trying not to crash  pre oh there daddy daddy now you ripped my fur oh baby baby be sweating out my hair took fortyfive minutes to get all dressed up we ain't even gon' make it to this club   take all of me i just wanna be the girl you like girl you like the kind of girl you like girl you like take all of me i just wanna be the girl you like girl you like the kinda girl you like is right here with me right here with me right here with me right here with me   hello estce que tu aimes le sexe  le sexe je veux dire  l'activité physique le coït tu aimes ça  tu ne t'intéresses pas au sexe  les hommes pensent que les féministes détestent le sexe mais c'est une activité très stimulante et naturelle que les femmes adorent   take all of me i just wanna be the girl you like girl you like the kind of girl you like girl you like take all of me i just wanna be the girl you like girl you like the kinda girl you like is right here with me right here with me right here with me right here with me hello   bzzbzzbzzbzzbzzbzzwop,2013.0,"['part', 'yoncé', 'let', 'hear', 'say', 'hey', 'm', 'carter', 'give', 'see', 'club', 'fiftyleven', 'girl', 'posted', 'back', 'diamond', 'fang', 'grill', 'brooklyn', 'brim', 'eye', 'sitting', 'low', 'every', 'boy', 'got', 'smoke', 'look', 'instagram', 'cake', 'pound', 'circulate', 'image', 'time', 'come', 'around', 'g', 'tell', 'im', 'looking', 'babe', 'walk', 'way', 'baby', 'take', 'aim', 'drop', 'bass', 'mane', 'get', 'lower', 'radio', 'speed', 'go', 'slower', 'high', 'like', 'treble', 'pumping', 'mids', 'ya', 'man', 'aint', 'ever', 'seen', 'booty', 'think', 'keep', 'name', 'rolling', 'tongue', 'cause', 'wanna', 'smash', 'ill', 'write', 'another', 'one', 'sneezed', 'beat', 'sicker', 'mouth', 'liquor', 'hook', 'beyoncé', 'happy', 'paris', 'partition', 'driver', 'roll', 'please', 'need', 'seeing', 'knee', 'took', 'fortyfive', 'minute', 'dressed', 'even', 'gonna', 'make', 'mascara', 'running', 'red', 'lipstick', 'smudged', 'oh', 'horny', 'yeah', 'want', 'fuck', 'popped', 'button', 'ripped', 'blouse', 'monica', 'lewinskyd', 'gown', 'pre', 'daddy', 'didnt', 'bring', 'towel', 'better', 'slow', 'gon', 'kind', 'kinda', 'right', 'fast', 'swear', 'saw', 'camera', 'flash', 'handprints', 'footprint', 'glass', 'good', 'grip', 'as', 'private', 'show', 'music', 'blasting', 'call', 'peach', 'nasty', 'wine', 'drip', 'well', 'talk', 'trash', 'chauffeur', 'eavesdropping', 'trying', 'crash', 'fur', 'sweating', 'hair', 'hello', 'estce', 'que', 'tu', 'aimes', 'le', 'sexe', 'je', 'veux', 'dire', 'lactivité', 'physique', 'coït', 'ça', 'ne', 'tintéresses', 'pa', 'au', 'hommes', 'pensent', 'féministes', 'détestent', 'mais', 'cest', 'une', 'activité', 'très', 'stimulante', 'et', 'naturelle', 'femmes', 'adorent', 'bzzbzzbzzbzzbzzbzzwop']",0.027,0.812,0.161,Positive,0.161
Beyoncé,Mine,BEYONCÉ,2013-12-13,beyoncé i've been watching for the signs took a trip to clear my mind oh now i'm even more lost and you're still so fine oh my oh my been having conversations about breakups and separations i'm not feeling like myself since the baby are we gonna even make it oh 'cause if we are we're taking this a little too far if we are we're taking this a little too far baby if we are we're taking this a little too far me being wherever i'm at worried about wherever you are we're taking this a little too far we're taking this a little too far we're taking this a little too far    drake know you wanna roll with a good girl do it big do it all for a good girl one time this is a song for the good girl dont sleep when you know you got it good girl one time this is a song for the good girl wanna roll wanna roll with a good girl one time this is a song for the good girl and i still keep it hood still treat you like i should wassup   beyoncé on my mind up past my bedtime no rest at the kingdom alone in my place my heart is away all that i can think of is we should get married we should get married let's stop holding back on this and let's get carried away  pre beyoncé stop making a big deal out of the little things 'cause i got big deals and i got little things got everything i'm asking for but you stop making a big deal out of the little things let's get carried away come right now you know where i stay    drake  beyoncé i just wanna say you're mine you're mine i just wanna say you're mine you're mine fuck what you heard you're mine you're mine all i'm really asking for is you you're mine you're mine i just wanna say you're mine you're mine fuck what you heard you're mine you're mine as long as you know who you belong to    drake know you wanna roll with a good girl do it big do it all for a good girl one time this is a song for the good girl dont sleep when you know you got it good girl one time this is a song for the good girl wanna roll wanna roll with a good girl one time this is a song for the good girl and i still keep it hood still treat you like i should wassup   drake from eight until late i think bout you you own my nights i dont know what to do do i can't get no rest can't get no sleep this whole thing got way too deep and we should  pre drake stop making a big deal out of the little things 'cause i got big deals and i got little things got everything i'm asking for but you stop making a big deal out of the little things let's get carried away come right now you know where i stay    drake  beyoncé i just wanna say you're mine you're mine i just wanna say you're mine you're mine fuck what you heard you're mine you're mine all i'm really asking for is you you're mine you're mine i just wanna say you're mine you're mine fuck what you heard you're mine you're mine as long as you know who you belong to    drake know you wanna roll with a good girl do it big do it all for a good girl one time this is a song for the good girl dont sleep when you know you got it good girl one time this is a song for the good girl wanna roll wanna roll with a good girl one time this is a song for the good girl and i still keep it hood still treat you like i should wassup  4 drake pull up on you i gotta pull up on you you gon' make me have to pull up on you dont go ghost on me i'ma go thriller on you i'ma just pull up on you i'ma let my hands do the talking when i see you baby girl i miss feeling on youpull up on you i miss everything that's real about you and that's everything about you that's just how i feel about you pull up on you i been about you and im still about you but we ain't finished talking pull up on you i told you you dont need to worry about them bitches all them fives need to listen when the ten is talking pull up on you 'cause they dont wanna see you happier than them and girl you swear they all ya friends and that's been a problem pull up on you you the one they hate just come with that i know you think it's funny that your ex is not a running back but that nigga came running back pull up on you and you tell me that youre done with that and i believe it's true as long as you know who you belong to   beyoncé all im really asking for is you long as you know who you belong to,2013.0,"['beyoncé', 'ive', 'watching', 'sign', 'took', 'trip', 'clear', 'mind', 'oh', 'im', 'even', 'lost', 'still', 'fine', 'conversation', 'breakup', 'separation', 'feeling', 'like', 'since', 'baby', 'gonna', 'make', 'cause', 'were', 'taking', 'little', 'far', 'wherever', 'worried', 'drake', 'know', 'wanna', 'roll', 'good', 'girl', 'big', 'one', 'time', 'song', 'dont', 'sleep', 'got', 'keep', 'hood', 'treat', 'wassup', 'past', 'bedtime', 'rest', 'kingdom', 'alone', 'place', 'heart', 'away', 'think', 'get', 'married', 'let', 'stop', 'holding', 'back', 'carried', 'pre', 'making', 'deal', 'thing', 'everything', 'asking', 'come', 'right', 'stay', 'say', 'mine', 'fuck', 'heard', 'really', 'long', 'belong', 'eight', 'late', 'bout', 'night', 'cant', 'whole', 'way', 'deep', '4', 'pull', 'gotta', 'gon', 'go', 'ghost', 'ima', 'thriller', 'hand', 'talking', 'see', 'miss', 'youpull', 'thats', 'real', 'feel', 'aint', 'finished', 'told', 'need', 'worry', 'bitch', 'five', 'listen', 'ten', 'happier', 'swear', 'ya', 'friend', 'problem', 'hate', 'funny', 'ex', 'running', 'nigga', 'came', 'tell', 'youre', 'done', 'believe', 'true']",0.076,0.814,0.11,Positive,0.11
Beyoncé,Hold Up,Lemonade,2016-04-23,hold up they don't love you like i love you slow down they don't love you like i love you back up they don't love you like i love you step down they don't love you like i love you can't you see there's no other man above you what a wicked way to treat the girl that loves you hold up they don't love you like i love you oh down they don't love you like i love you   something don't feel right because it ain't right especially comin' up after midnight i smell your secrets and i'm not too perfect to ever feel this worthless how did it come down to this scrolling through your call list i don't wanna lose my pride but i'ma fuck me up a bitch know that i kept it sexy you know i kept it fun there's something that i'm missing maybe my head for one  refrain what's worst lookin' jealous or crazy jealous or crazy or like being walked all over lately walked all over lately i'd rather be crazy   hold up they don't love you like i love you slow down they don't love you like i love you back up they don't love you like i love you step down they don't love you like i love you can't you see there's no other man above you what a wicked way to treat the girl that loves you hold up they don't love you like i love you slow down they don't love you like i love you   let's imagine for a moment that you never made a name for yourself or mastered wealth they had you labeled as a king never made it out the cage still out there movin' in them streets never had the baddest woman in the game up in your sheets would they be down to ride no they used to hide from you lie to you but y'all know we were made for each other so i find you and hold you down me sing se   hold up they don't love you like i love you slow down they don't love you like i love you back up they don't love you like i love you step down they don't love you like i love you can't you see there's no other man above you what a wicked way to treat the girl that loves you hold up they don't love you like i love you slow down they don't love you like i love you   hey this such a shame you let this good love go to waste i always keep the top tier 5 star backseat lovin' in the car like make that wood like make that wood holly like a boulevard  refrain what's worse lookin' jealous or crazy jealous and crazy or like being walked all over lately walked all over lately i'd rather be crazy   hold up they don't love you like i love you slow down they don't love you like i love you back up they don't love you like i love you step down they don't love you like i love you can't you see there's no other man above you what a wicked way to treat the girl that loves you hold up they don't love you like i love you oh down they don't love you like i love you   i hop up out my bed and get my swag on i look in the mirror say what's up what's up what's up what's up i hop up out my bed and get my swag on i look in the mirror say what's up what's up what's up what's up,2016.0,"['hold', 'love', 'like', 'slow', 'back', 'step', 'cant', 'see', 'there', 'man', 'wicked', 'way', 'treat', 'girl', 'oh', 'something', 'feel', 'right', 'aint', 'especially', 'comin', 'midnight', 'smell', 'secret', 'im', 'perfect', 'ever', 'worthless', 'come', 'scrolling', 'call', 'list', 'wanna', 'lose', 'pride', 'ima', 'fuck', 'bitch', 'know', 'kept', 'sexy', 'fun', 'missing', 'maybe', 'head', 'one', 'refrain', 'whats', 'worst', 'lookin', 'jealous', 'crazy', 'walked', 'lately', 'id', 'rather', 'let', 'imagine', 'moment', 'never', 'made', 'name', 'mastered', 'wealth', 'labeled', 'king', 'cage', 'still', 'movin', 'street', 'baddest', 'woman', 'game', 'sheet', 'would', 'ride', 'used', 'hide', 'lie', 'yall', 'find', 'sing', 'se', 'hey', 'shame', 'good', 'go', 'waste', 'always', 'keep', 'top', 'tier', '5', 'star', 'backseat', 'lovin', 'car', 'make', 'wood', 'holly', 'boulevard', 'worse', 'hop', 'bed', 'get', 'swag', 'look', 'mirror', 'say']",0.42,0.518,0.062,Negative,0.42
