Artist,Title,Album,Date,Lyric,Year,words,negative,neutral,positive,dominant_sentiment,dominant_sentiment_score
Katy Perry,Simple,(A) Katy Perry [Shelved],2005-05-24,you're such a poet i wish i could be wesley willis my words would flow like honey sweet and laid on thick you're so edgy you dont even need a rhyming dictionary i wipe my hands on your jeans cause they are more distressed so they sayyou got ocd and they claim you can barely read but you say don't bother me with all of your reality   but it could be so simple you were thinking life should be that simple who would have thought it i wish it were just so simple don't know what you were thinking but the point's been missed you've made a mess who would have guessed that it's as simple as it seems   so what you're a genius but you've got a lot to learn like the time you lost your apartment cause you bought too much vuitton you park in a loading zone you sleep with the lights all on you cross your i's and dot your t's all it goes to show   that it could be so simple you were thinking life should be that simple who would have thought it i wish it were just that simple don't know what you were thinking the point's been missed we've made a mess who would have guessed that it's as simple as it seems   i'm not saying that it's a piece of cake just take a moment to reevaluate the possibilities the situations the opportunities that are waiting oh the possibilities oh i   that it could be so simple you were thinking life should be that simple who would have thought it i wish it were just that simple don't know what you were thinking the point's been missed we've made a mess who would have guessed that it's as simple as it seems  4 we could talk all day about your eccentricities what i mean to say oh is that i need you listen please and focus on life's simplicities so don't be afraid to strip it away cause at the end of the day it's still as simple as it seems   it is all so simple just deal with it,2005.0,"['poet', 'wish', 'could', 'wesley', 'willis', 'word', 'would', 'flow', 'like', 'honey', 'sweet', 'laid', 'thick', 'edgy', 'dont', 'even', 'need', 'rhyming', 'dictionary', 'wipe', 'hand', 'jean', 'cause', 'distressed', 'sayyou', 'got', 'ocd', 'claim', 'barely', 'read', 'say', 'bother', 'reality', 'simple', 'thinking', 'life', 'thought', 'know', 'point', 'missed', 'made', 'mess', 'guessed', 'seems', 'genius', 'lot', 'learn', 'time', 'lost', 'apartment', 'bought', 'much', 'vuitton', 'park', 'loading', 'zone', 'sleep', 'light', 'cross', 'is', 'dot', 't', 'go', 'show', 'weve', 'im', 'saying', 'piece', 'cake', 'take', 'moment', 'reevaluate', 'possibility', 'situation', 'opportunity', 'waiting', 'oh', '4', 'talk', 'day', 'eccentricity', 'mean', 'listen', 'please', 'focus', 'simplicity', 'afraid', 'strip', 'away', 'end', 'still', 'deal']",0.062,0.862,0.076,Positive,0.076
Katy Perry,Daisies (Can’t Cancel Pride),,2020-06-26,told them your dreams and they all started laughing i guess you're out of your mind 'til it actually happens  pre i'm the small town one in seven billion why can't it be me   they told me i was out there tried to knock me down took those sticks and stones showed 'em i could build a house they tell me that i'm crazy but i'll never let 'em change me 'til they cover me in daisies daisies daisies they said i'm going nowhere tried to count me out took those sticks and stones showed 'em i could build a house they tell me that i'm crazy but i'll never let 'em change me 'til they cover me in daisies daisies daisies   when did we all stop believing in magic why did we put all our hopes in a box in the attic  pre i'm the long shot i'm the hail mary why can't it be me   they told me i was out there tried to knock me down knock me down took those sticks and stones showed 'em i could build a house they tell me that i'm crazy but i'll never let 'em change me 'til they cover me in daisies daisies daisies they said i'm going nowhere tried to count me out took those sticks and stones showed 'em i could build a house they tell me that i'm crazy but i'll never let 'em change me 'til they cover me in daisies daisies daisies   us girls we are so magical soft skin red lips so kissable i wanna see your peacockcockcock it felt so wrong it felt so right don't mean i'm in love tonight tonight tonight tonight i'm walking on air tonight i'm walking on air i'm walking i'm walking on air tonight i'm walking on air another one in the basket tonight tonight  i'm walking on air can't touch this i'm walking i'm walking on air another one in the casket tonight i'm walking on air swish swish bish let's go they know what is what but they don't know what is what but they don't know what is what but they don't know what is what they just strut what the    they said i'm going nowhere tried to count me out count me out took those sticks and stones showed 'em i could build a house they tell me that i'm crazy but i'll never let 'em change me 'til they cover me in daisies daisies daisies,2020.0,"['told', 'dream', 'started', 'laughing', 'guess', 'mind', 'til', 'actually', 'happens', 'pre', 'im', 'small', 'town', 'one', 'seven', 'billion', 'cant', 'tried', 'knock', 'took', 'stick', 'stone', 'showed', 'em', 'could', 'build', 'house', 'tell', 'crazy', 'ill', 'never', 'let', 'change', 'cover', 'daisy', 'said', 'going', 'nowhere', 'count', 'stop', 'believing', 'magic', 'put', 'hope', 'box', 'attic', 'long', 'shot', 'hail', 'mary', 'u', 'girl', 'magical', 'soft', 'skin', 'red', 'lip', 'kissable', 'wanna', 'see', 'peacockcockcock', 'felt', 'wrong', 'right', 'mean', 'love', 'tonight', 'walking', 'air', 'another', 'basket', 'touch', 'casket', 'swish', 'bish', 'go', 'know', 'strut']",0.052,0.901,0.047,Negative,0.052
Katy Perry,Sex Sells,Unreleased Songs,,i will not philosophize about the meaning of life let's take no time 'cause the teasing isn't right let's skip the foreplay we know were gonna do it anyway cause all i'm selling is  hook sex sex on your radio selling is sex sex just like a machine   have you seen my video look at me i'm dancing in slowmo and the ad campaign i'm bathing in champagne cause i'm a lady good for one thing maybe and all i'm selling is  hook  sex sex on your radio selling is sex sex just like a machine a machine yeah a machine all i'm selling is sex baby sex baby sex on your radio all i'm selling is sex just like a machine   will you be my sugar daddy if i promise to behave then you can have me but you'll be digging your own grave oh it's not worth it i've already done my circuit all i'm selling is all i'm giving is all i'm selling is  hook  sex sex on your radio selling is sex sex just like a machine i'm selling it sex on your radio i'm selling it sex just like a machine,,"['philosophize', 'meaning', 'life', 'let', 'take', 'time', 'cause', 'teasing', 'right', 'skip', 'foreplay', 'know', 'gonna', 'anyway', 'im', 'selling', 'hook', 'sex', 'radio', 'like', 'machine', 'seen', 'video', 'look', 'dancing', 'slowmo', 'ad', 'campaign', 'bathing', 'champagne', 'lady', 'good', 'one', 'thing', 'maybe', 'yeah', 'baby', 'sugar', 'daddy', 'promise', 'behave', 'digging', 'grave', 'oh', 'worth', 'ive', 'already', 'done', 'circuit', 'giving']",0.04,0.852,0.107,Positive,0.107
Katy Perry,Psycho Love,Fingerprints [Shelved],,twelve noon watch her sleeping in your room why can't that still be me two o'clock and i'm still driving 'round your block feeling a little crazy  pre  you'd change your number and move to the suburbs you run but you can't hide you thought i'd forget all of your passwords but i like showing up at your place so surprising that look on your face    i'm underneath your street light blowing kisses every night psycho love forever i'm right outside your window throwing rocks and starting fights psycho love forever   so weeks pass and i found myself another catch someone who loves me equally yeah the tables turn and you're not happy when you learn he's moving in with me  pre  he bought me a big ring we moved to the city now you won't stop calling 'cause you always thought that you'd have your plan b now you're showing up at my place not surprising we both play this game    you're underneath my street light blowing kisses every night psycho love forever you're right outside my window throwing rocks and starting fights psycho love forever   la la la la la la la la forever la la la la la la la la  pre  you'd change your number and move to the suburbs you run but you can't hide you thought i'd forget all of your passwords but i like showing up at your place so surprising that look on your face    i'm underneath your street light blowing kisses every night psycho love forever i'm right outside your window throwing rocks and starting fights psycho love forever i'm underneath your street light blowing kisses every night psycho love forever i'm right outside your window throwing rocks and starting fights psycho love,,"['twelve', 'noon', 'watch', 'sleeping', 'room', 'cant', 'still', 'two', 'oclock', 'im', 'driving', 'round', 'block', 'feeling', 'little', 'crazy', 'pre', 'change', 'number', 'move', 'suburb', 'run', 'hide', 'thought', 'id', 'forget', 'password', 'like', 'showing', 'place', 'surprising', 'look', 'face', 'underneath', 'street', 'light', 'blowing', 'kiss', 'every', 'night', 'psycho', 'love', 'forever', 'right', 'outside', 'window', 'throwing', 'rock', 'starting', 'fight', 'week', 'pas', 'found', 'another', 'catch', 'someone', 'equally', 'yeah', 'table', 'turn', 'happy', 'learn', 'he', 'moving', 'bought', 'big', 'ring', 'moved', 'city', 'stop', 'calling', 'cause', 'always', 'plan', 'b', 'play', 'game', 'la']",0.07,0.661,0.269,Positive,0.269
Katy Perry,The One That Got Away / Thinking of You,,2015-10-30,part i the one that got away   summer after high school when we first met we'd make out in your mustang to radiohead and on my 8th birthday we got matching tattoos used to steal your parents' liquor and climb to the roof talk about our future like we had a clue never planned that one day i'd be losing you   in another life i would be your girl we'd keep all our promises be us against the world in another life i would make you stay so i don't have to say you were the one that got away the one that got away   i was june and you were my johnny cash never one without the other we made a pact sometimes when i miss you i put those records on woah someone said you had your tattoo removed saw you downtown singing the blues it's time to face the music i'm no longer your muse   in another life i would be your girl we'd keep all our promises be us against the world in another life i would make you stay so i don't have to say you were the one that got away the one that got away part ii thinking of you   'cause when i'm with him i am thinking of you thinking of you what you would do if you were the one who was spending the night oh i wish that i was looking into your when i'm with him i am thinking of you thinking of you what you would do if you were the one who was spending the night oh i wish that i was looking into your part iii the one that got away  thinking of you   'cause all this money can't buy me a time machine no can't replace you with a million rings no i should've told you what you meant to me whoa 'cause now i pay the price   in another life i would be your girl we'd keep all our promises be us against the world in another life i would make you stay so i don't have to say you were the one that got away the one that got away   the one 'cause when i'm with him i am thinking of you thinking of you thinking of you,2015.0,"['part', 'one', 'got', 'away', 'summer', 'high', 'school', 'first', 'met', 'wed', 'make', 'mustang', 'radiohead', '8th', 'birthday', 'matching', 'tattoo', 'used', 'steal', 'parent', 'liquor', 'climb', 'roof', 'talk', 'future', 'like', 'clue', 'never', 'planned', 'day', 'id', 'losing', 'another', 'life', 'would', 'girl', 'keep', 'promise', 'u', 'world', 'stay', 'say', 'june', 'johnny', 'cash', 'without', 'made', 'pact', 'sometimes', 'miss', 'put', 'record', 'woah', 'someone', 'said', 'removed', 'saw', 'downtown', 'singing', 'blue', 'time', 'face', 'music', 'im', 'longer', 'muse', 'ii', 'thinking', 'cause', 'spending', 'night', 'oh', 'wish', 'looking', 'iii', 'money', 'cant', 'buy', 'machine', 'replace', 'million', 'ring', 'told', 'meant', 'whoa', 'pay', 'price']",0.041,0.918,0.042,Positive,0.042
Katy Perry,Breakout,Unreleased Songs,,every week's the same stuck in school's so lame my parents say that i'm lazy getting up at 8am's crazy tired of being told what to do so unfair so uncool  pre the day's too long and i'm holding on 'til i hear the bell ring 'cause that's time when we're gonna time when we're gonna   breakout let the party start we're gonna stay out gonna break some hearts we're gonna dance 'til the dance floor falls apart uhoh all over again we're gonna wake up everyone we know we're gonna have some fun gonna lose control feels so good to let go ohoh go ohoh   hanging out's just something we like to do my friends and the mess we get into these are the lessons that we choose not a book full of things we'll never use  pre the day's too long yeah i'm holding on 'til i hear the bell ring 'cause that's time when we're gonna time when we're gonna   breakout let the party start we're gonna stay out gonna break some hearts we're gonna dance 'til the dance floor falls apart uhoh all over again we're gonna wake up everyone we know we're gonna have some fun gonna lose control feels so good to let go ohoh go ohoh   wish it would never end spending time with my friends oh with my friends   breakout let the party start we're gonna stay out gonna break some hearts we're gonna dance 'til the dance floor falls apart uhoh all over again we're gonna wake up everyone we know we're gonna have some fun gonna lose control feels so good to let go breakout let the party start we're gonna stay out gonna break some hearts we're gonna dance 'til the dance floor falls apart uhoh all over again we're gonna wake up everyone we know we're gonna have some fun gonna lose control feels so good to let go ohoh go ohoh,,"['every', 'week', 'stuck', 'school', 'lame', 'parent', 'say', 'im', 'lazy', 'getting', '8ams', 'crazy', 'tired', 'told', 'unfair', 'uncool', 'pre', 'day', 'long', 'holding', 'til', 'hear', 'bell', 'ring', 'cause', 'thats', 'time', 'were', 'gonna', 'breakout', 'let', 'party', 'start', 'stay', 'break', 'heart', 'dance', 'floor', 'fall', 'apart', 'uhoh', 'wake', 'everyone', 'know', 'fun', 'lose', 'control', 'feel', 'good', 'go', 'ohoh', 'hanging', 'out', 'something', 'like', 'friend', 'mess', 'get', 'lesson', 'choose', 'book', 'full', 'thing', 'well', 'never', 'use', 'yeah', 'wish', 'would', 'end', 'spending', 'oh']",0.081,0.772,0.147,Positive,0.147
Katy Perry,It’s Okay To Believe,(A) Katy Perry [Shelved],,this was big for us forever changing you and me allow me to be ambiguous though i can't stand ambiguity i'll beat around this burning bush trying to put the fire out when all the shoving came to push the words just stayed stuck in my mouth   'cause it's okay to believe in something it's alright to live your live for someone ba da da dum it's okay to believe in something it's alright to live your live for someone yeah ba da da dum   so we might lose but i'm glad i didn't leave i wear my soul on my shoes if not my heart upon my sleeve if i'm not allowed to speak aloud of what you really mean to me then'll type it bold when i spell it out i t s l o v e   'cause it's okay to believe in something it's alright to live your live for someone ba da da dum it's okay to believe in something it's alright to live your live for someone yeah ba da da dum   so why do i hesitate for my cocoon to break second guess every move that i make second guess every move that you make this was big for us changing you and me   oh somebody tell me it's okay to believe in something it's alright to live your life for someone yeah ba da da dum   stand up for what you believe in take pride for who you are yeah yeah oh yeah stand up for what you believe in take pride for who you are yeah yeah oh yeah stand up for what you believe in take pride for who you are yeah yeah oh yeah,,"['big', 'u', 'forever', 'changing', 'allow', 'ambiguous', 'though', 'cant', 'stand', 'ambiguity', 'ill', 'beat', 'around', 'burning', 'bush', 'trying', 'put', 'fire', 'shoving', 'came', 'push', 'word', 'stayed', 'stuck', 'mouth', 'cause', 'okay', 'believe', 'something', 'alright', 'live', 'someone', 'ba', 'da', 'dum', 'yeah', 'might', 'lose', 'im', 'glad', 'leave', 'wear', 'soul', 'shoe', 'heart', 'upon', 'sleeve', 'allowed', 'speak', 'aloud', 'really', 'mean', 'thenll', 'type', 'bold', 'spell', 'l', 'v', 'e', 'hesitate', 'cocoon', 'break', 'second', 'guess', 'every', 'move', 'make', 'oh', 'somebody', 'tell', 'life', 'take', 'pride']",0.026,0.747,0.227,Positive,0.227
Katy Perry,Search Me,Katy Hudson,2001-02-08,through this skin you see my heart through this laughter you feel my pain even through this mask you see my face for you are the only one who really knows just who i am   and you search me and you know all the secrets of my heart and you search me revealing the mysteries of who you are you search me   growing up never comes easily in your hands you're the potter molding me then why do i wear this mask and play this game of hide and seek when you are the only one who really knows just who i am   and you search me and you know all the secrets of my heart and you search me revealing the mysteries of who you are and you search me and you know all the secrets of my heart and you search me revealing the mysteries of who you are   my father my father you are my father oh and i am your child and you hear my cry even at the midnight   and you search me and you know all the secrets of my heart and you search me revealing the mysteries of who you are and you search me and you know all the secrets of my heart and you search me revealing the mysteries of who you are the mysteries of who you are the mysteries of who you are,2001.0,"['skin', 'see', 'heart', 'laughter', 'feel', 'pain', 'even', 'mask', 'face', 'one', 'really', 'know', 'search', 'secret', 'revealing', 'mystery', 'growing', 'never', 'come', 'easily', 'hand', 'potter', 'molding', 'wear', 'play', 'game', 'hide', 'seek', 'father', 'oh', 'child', 'hear', 'cry', 'midnight']",0.042,0.925,0.033,Negative,0.042
Katy Perry,The Driveway,Fingerprints [Shelved],,remember last summer under the shooting stars we made a wish were together forever and let nobody tear us apart and how fun was that ride down to mexico we took a chance on those road side tacos and we got sick by the side of the road  pre  and the fall came and we had that big pot lot party and your little sixteen year old brother spilt wine all over my carpet and i got mad you thought it was funny i stayed mad all winter it's so sad a thing like that becomes such a splinter   i tried it your way but i got nothing to show it's been the same same and the story's getting old so i guess the driveway is the end of the road for us it's too late let the credits start to roll   i'm almost twentythree and i'm barely hanging on i can't keep crashing couches and going to sleep at dawn and when were you going to take me somewhere that i can dress up where we can act grown up do you ever wanna clean up  pre  we share a car you thought it was okay you couldn't have cut it closer i'm sick of it this is it and now the party's over   i tried it your way but i got nothing to show it's been the same same and the story's getting old so i guess the driveway is the end of the road for us it's too late let the credits start to roll   someday you'll make some girl happy i know you'll get though you'll know just what to say to do because i showed you   i tried it your way but i got nothing to show it's been the same same and the story's getting old so i guess the driveway is the end of the road for us it's too late let the credits start to roll   let the credits start to roll oh yea yea yea yea yea yea yeah oh it's too late it's too late it's too late i guess the driveway will be the end of the road,,"['remember', 'last', 'summer', 'shooting', 'star', 'made', 'wish', 'together', 'forever', 'let', 'nobody', 'tear', 'u', 'apart', 'fun', 'ride', 'mexico', 'took', 'chance', 'road', 'side', 'taco', 'got', 'sick', 'pre', 'fall', 'came', 'big', 'pot', 'lot', 'party', 'little', 'sixteen', 'year', 'old', 'brother', 'spilt', 'wine', 'carpet', 'mad', 'thought', 'funny', 'stayed', 'winter', 'sad', 'thing', 'like', 'becomes', 'splinter', 'tried', 'way', 'nothing', 'show', 'story', 'getting', 'guess', 'driveway', 'end', 'late', 'credit', 'start', 'roll', 'im', 'almost', 'twentythree', 'barely', 'hanging', 'cant', 'keep', 'crashing', 'couch', 'going', 'sleep', 'dawn', 'take', 'somewhere', 'dress', 'act', 'grown', 'ever', 'wanna', 'clean', 'share', 'car', 'okay', 'cut', 'closer', 'someday', 'make', 'girl', 'happy', 'know', 'get', 'though', 'say', 'showed', 'oh', 'yea', 'yeah']",0.036,0.849,0.115,Positive,0.115
Katy Perry,Wish You The Worst,(A) Katy Perry [Shelved],,i saw you at the grocery store oh you both looked happy picking out the usual she's a carbon copy of everything you lost of everything i'm not i guess you just forgot how to pick 'em   if she's the one i've heard about i'm disappointed if she's the reason why you left i'm not impressed at all well this looks like the end yeah i hope we can still be friends congratulations   let me be the first to wish you the worst 'cause i think you deserve each other let me be the curse that creeps under your skin until your heart caves in and you wish she was me again  post and again and again and again   well someone had to tell the truth and i'm always honest i read you like an open book and it's obvious to me she's just the one between heading no where fast sure it's gonna last forever   let me be the first to wish you the worst 'cause i think you deserve each other let me be the curse that creeps under your skin until your heart caves in and you wish she was me again let me be the first to wish you the worst 'cause i think you deserve each other let me be the curse that creeps under your skin until your heart caves in and you wish she was me again   and again and again and again oh you wish you wish you wish you do,,"['saw', 'grocery', 'store', 'oh', 'looked', 'happy', 'picking', 'usual', 'carbon', 'copy', 'everything', 'lost', 'im', 'guess', 'forgot', 'pick', 'em', 'one', 'ive', 'heard', 'disappointed', 'reason', 'left', 'impressed', 'well', 'look', 'like', 'end', 'yeah', 'hope', 'still', 'friend', 'congratulation', 'let', 'first', 'wish', 'worst', 'cause', 'think', 'deserve', 'curse', 'creep', 'skin', 'heart', 'cave', 'post', 'someone', 'tell', 'truth', 'always', 'honest', 'read', 'open', 'book', 'obvious', 'heading', 'fast', 'sure', 'gonna', 'last', 'forever']",0.11,0.7,0.191,Positive,0.191
Katy Perry,Spend The Night,Fingerprints [Shelved],,i've never asked to define our time it's understood so crystal clear when your eyes lock mine we so connect but we're almost scared of it so no strings attached is where it's at for the moment   so just relax baby lay back and let's just spend the night spend the night woah oh oh undo my dress let down my hair and let's just spend the night spend the night   yeah i play cool like i've met a hundred yous and for tonight you're just right to be the one i use but you break me down i forget the games i play oh you wrap me up in your arms and i just melt away   so just relax baby lay back and let's just spend the night spend the night whoa oh oh undo my dress let down my hair and let's just spend the night spend the night   oh if i could freeze this moment in my heart shaped locket wear you around my neck so you won't be forgotten i would i would oh if i could tell you everything i feel for you baby spill my heart out on the floor and have it be reciprocated i would you know i would   so just relax baby lay back and let's just spend the night spend the night woah oh oh undo my dress let down my hair and let's just spend the night spend the night oh baby relax oh baby lay back and let's just spend the night spend the night undo my dress let down my hair oh if i could freeze this moment in my heart shaped locket and let's just wear you around my neck so you won't be forgotten spend the night spend the night i would i would woah oh oh,,"['ive', 'never', 'asked', 'define', 'time', 'understood', 'crystal', 'clear', 'eye', 'lock', 'mine', 'connect', 'were', 'almost', 'scared', 'string', 'attached', 'moment', 'relax', 'baby', 'lay', 'back', 'let', 'spend', 'night', 'woah', 'oh', 'undo', 'dress', 'hair', 'yeah', 'play', 'cool', 'like', 'met', 'hundred', 'yous', 'tonight', 'right', 'one', 'use', 'break', 'forget', 'game', 'wrap', 'arm', 'melt', 'away', 'whoa', 'could', 'freeze', 'heart', 'shaped', 'locket', 'wear', 'around', 'neck', 'forgotten', 'would', 'tell', 'everything', 'feel', 'spill', 'floor', 'reciprocated', 'know']",0.03,0.842,0.128,Positive,0.128
