Artist,Title,Album,Date,Lyric,Year,words,negative,neutral,positive,dominant_sentiment,dominant_sentiment_score
Katy Perry,Not the End of the World,Smile (Fan Edition),2020-08-28,it's not the end of the world no not the end of the world throw on your fancy attire fears in the fire dont lose hope it's no funeral we're attending actually just the beginning throw on your fancy attire fears in the fire dont lose hope it's not the end of the no not the end of the world   you can catch a star if the sky is falling down there's a golden lining up in every single cloud you can take a frown turn it all the way around all the way around all the all the way around a fortune teller told me the power's in your mind you might see a cliff but i see a way to fly flipping off the flop now i just enjoy the ride just enjoy the ride yeah i just enjoy the ride  pre na na na na what a time na na na na to be alive don't say goodbye   it's not the end of the world no not the end of the world throw on your fancy attire fears in the fire don't lose hope it's no funeral were attending actually just the beginning throw on your fancy attire fears in the fire dont lose hope it's not the end of the no not the end of the world   you can make a wish even on a satellite on a plastic lash or anything you like you can tame the dragon if youre not afraid to fight not afraid to fight no i'm not afraid  pre na na na na what a time na na na na to be alive don't say goodbye don't say goodbye   its not the end of the world no not the end of the world throw on your fancy attire fears in the fire don't lose hope it's no funeral we're attending actually just the beginning throw on your fancy attire fears in the fire don't lose hope   na na na na na na na na don't say goodbye don't say goodbye na na na na na na na na don't say goodbye,2020.0,"['end', 'world', 'throw', 'fancy', 'attire', 'fear', 'fire', 'dont', 'lose', 'hope', 'funeral', 'were', 'attending', 'actually', 'beginning', 'catch', 'star', 'sky', 'falling', 'there', 'golden', 'lining', 'every', 'single', 'cloud', 'take', 'frown', 'turn', 'way', 'around', 'fortune', 'teller', 'told', 'power', 'mind', 'might', 'see', 'cliff', 'fly', 'flipping', 'flop', 'enjoy', 'ride', 'yeah', 'pre', 'na', 'time', 'alive', 'say', 'goodbye', 'make', 'wish', 'even', 'satellite', 'plastic', 'lash', 'anything', 'like', 'tame', 'dragon', 'youre', 'afraid', 'fight', 'im']",0.201,0.682,0.118,Negative,0.201
Katy Perry,Pendulum,Witness,2017-06-09,you got patina ain't so green nah you earned this spot got your receipts yeah funny gotta add addendums to your dreams still you never sleep no you never sleep ah oh you learned to dance to bob and weave yeah to let that water roll off easy yeah you grew yourself above the weeds taller than the trees oh  pre so don't try and reinvent your wheel 'cause you're too original baby just stay classic ain't broke ain't broke don't fix it your highs your lows just ride it   it's a pendulum it all comes back around it's a pendulum it's a pendulum life's a pendulum it'll all come back around it's a pendulum it all comes back it all comes back   so just take those punches on the chin yeah don't fight the changes in the wind no no 'cause you'll find your way home oh if you find a way to let go just let go  pre don't try and reinvent your wheel your wheel 'cause you're too original original baby just stay classic ain't broke ain't broke don't fix it your highs your lows just ride it   it's a pendulum it all comes back around pendulum it's a pendulum all comes back around it's a pendulum life's a pendulum it'll all come back around it's a pendulum it all comes back it all comes back around   and there is no need to worry the pages keep on turning and it goes on and on comes all the way around there is no need to hurry if there's a fire burning 'cause it goes on and on comes all the way around all the way around hey around oh all the way around c'mon ain't broke ain't broke don't fix it your highs your lows just ride it   it's a pendulum it all comes back around ohoh it's a pendulum it's a pendulum life is life is life's a pendulum it'll all come back around hey it's a pendulum it all comes back it all comes back it's a pendulum it all comes back around ohoh it's a pendulum all comes back around it's a pendulum life's a pendulum it'll all come back around pendulum it's a pendulum it all comes back it all comes back,2017.0,"['got', 'patina', 'aint', 'green', 'nah', 'earned', 'spot', 'receipt', 'yeah', 'funny', 'gotta', 'add', 'addendum', 'dream', 'still', 'never', 'sleep', 'ah', 'oh', 'learned', 'dance', 'bob', 'weave', 'let', 'water', 'roll', 'easy', 'grew', 'weed', 'taller', 'tree', 'pre', 'try', 'reinvent', 'wheel', 'cause', 'original', 'baby', 'stay', 'classic', 'broke', 'fix', 'high', 'low', 'ride', 'pendulum', 'come', 'back', 'around', 'life', 'itll', 'take', 'punch', 'chin', 'fight', 'change', 'wind', 'find', 'way', 'home', 'go', 'need', 'worry', 'page', 'keep', 'turning', 'hurry', 'there', 'fire', 'burning', 'hey', 'cmon', 'ohoh']",0.027,0.841,0.131,Positive,0.131
Katy Perry,Legendary Lovers,PRISM,2013-10-18,under a silver moon tropical temperature i feel my lotus bloom come closer i want your energy i want your aura you are my destiny my mantra  pre i never knew i could see something so clearly looking through my third eye never knew karma could be so rewarding and bring me to your light maybe this is the beginning of something so magical tonight oh ohohoh   take me down to the river underneath the bloodorange sun say my name like a scripture keep my heart beating like a drum legendary lovers we could be legendary la la la la la legendary lovers we should be legendary la la la la la   go down in history go down together into infinity forever your cleopatra your blushing juliet anything for your love a ride or die  pre oh i never knew i could see something so clearly looking through my third eye never knew karma could be so rewarding and bring me to your light maybe this is the beginning of something so magical tonight oh ohohoh   take me down to the river underneath the bloodorange sun say my name like a scripture keep my heart beating like a drum legendary lovers we could be legendary la la la la la legendary lovers we should be legendary la la la la la  interlude check it out legendary lovers legendary lovers legendary lovers  breakdown oh take me down to the river underneath the bloodorange sun say my name like a scripture keep my heart beating like a drum   legendary lovers we could be legendary la la la la la legendary lovers legendary lovers we should be legendary la la la la la oh take me down to the river underneath underneath the sun the bloodorange sun say my name like a scripture keep my heart beating like a drum oh baby legendary lovers legendary lovers we could be legendary la la la la la legendary lovers we should be legendary la la la la la  produced by max martin and dr luke,2013.0,"['silver', 'moon', 'tropical', 'temperature', 'feel', 'lotus', 'bloom', 'come', 'closer', 'want', 'energy', 'aura', 'destiny', 'mantra', 'pre', 'never', 'knew', 'could', 'see', 'something', 'clearly', 'looking', 'third', 'eye', 'karma', 'rewarding', 'bring', 'light', 'maybe', 'beginning', 'magical', 'tonight', 'oh', 'ohohoh', 'take', 'river', 'underneath', 'bloodorange', 'sun', 'say', 'name', 'like', 'scripture', 'keep', 'heart', 'beating', 'drum', 'legendary', 'lover', 'la', 'go', 'history', 'together', 'infinity', 'forever', 'cleopatra', 'blushing', 'juliet', 'anything', 'love', 'ride', 'die', 'interlude', 'check', 'breakdown', 'baby', 'produced', 'max', 'martin', 'dr', 'luke']",0.04,0.734,0.226,Positive,0.226
Katy Perry,Champagne Problems,Smile (Fan Edition),2020-08-28,uh   i wanna see you soon as i wipe the crust from my eyes 'til the day i die could you be the love of my life i'm a soldier for you baby i earned all my stripes ah  pre makeups to the breakups times we coulda gave up we put the dirty work in so now we know it's worth it now we're celebrating i'm so glad we made it this far ah uh   'cause baby all we got are champagne problems now 'cause baby all we got are champagne problems now woo   i wanna see you soon as i wipe the crust from my eyes 'til the day i die could you be the love of my life i'm a baller for you baby i pay any price ah  pre makeups to the breakups times we coulda gave up we put the dirty work in became a better version now we're celebrating i'm so glad we made it this far we both know the hardest part is over pull me closer pour a drink uh   'cause baby all we got all we got are are champagne problems now that's all we got 'cause baby all we got all we got are are champagne problems now  post yeah that's all we got all we got are champagne problems now yeah that's all we got all we got all we got all we got are champagne problems now   we both know the hardest part is over pull me closer pour a drink 'cause baby oh woah all we got   'cause baby all we got no no no no all we got are are champagne problems now that's all we got baby 'cause baby all we got all we got are are champagne problems now  post yeah that's all we got all we got all we got are are champagne problems now champagne problems yeah that's all we got all we got all we got are are champagne problems now champagne problems now,2020.0,"['uh', 'wanna', 'see', 'soon', 'wipe', 'crust', 'eye', 'til', 'day', 'die', 'could', 'love', 'life', 'im', 'soldier', 'baby', 'earned', 'stripe', 'ah', 'pre', 'makeup', 'breakup', 'time', 'coulda', 'gave', 'put', 'dirty', 'work', 'know', 'worth', 'were', 'celebrating', 'glad', 'made', 'far', 'cause', 'got', 'champagne', 'problem', 'woo', 'baller', 'pay', 'price', 'became', 'better', 'version', 'hardest', 'part', 'pull', 'closer', 'pour', 'drink', 'thats', 'post', 'yeah', 'oh', 'woah']",0.142,0.692,0.166,Positive,0.166
Katy Perry,Resilient,Smile (Fan Edition),2020-08-28,i know there's gotta be rain if i want the rainbows and i know the higher i climb the harder the wind blows yeah i've gone to sleep night after night punching a pillow but do you know the darker the night the brighter the stars glow   'cause i am resilient a full flower moment won't let the concrete hold me back oh no i am resilient born to be brilliant you'll see me grow right through the cracks yeah 'cause you're gonna watch this flower grow right through the cracks   i've got to shed all the skin if i want the distance let the sun in pull out the weeds and focus my vision 'cause theres no mistakes just bends and breaks and friction but do you know the hotter the fire the purer the gold is   'cause i am resilient a full flower moment won't let the concrete hold me back oh yeah i am resilient born to be brilliant i'm gonna grow right through the cracks oh   'cause i died every winter but survived all the weather look at me now look at me now i'm in full bloom yeah they tried to poison the water but i was a little stronger look at me now look at me now i light up the room oh yeah   'cause i am resilient i am resilient a full flower moment won't let the concrete hold me back no oh i am resilient born to be brilliant i'm gonna grow right through the cracks oh you're gonna watch this flower grow right through the cracks,2020.0,"['know', 'there', 'gotta', 'rain', 'want', 'rainbow', 'higher', 'climb', 'harder', 'wind', 'blow', 'yeah', 'ive', 'gone', 'sleep', 'night', 'punching', 'pillow', 'darker', 'brighter', 'star', 'glow', 'cause', 'resilient', 'full', 'flower', 'moment', 'let', 'concrete', 'hold', 'back', 'oh', 'born', 'brilliant', 'see', 'grow', 'right', 'crack', 'gonna', 'watch', 'got', 'shed', 'skin', 'distance', 'sun', 'pull', 'weed', 'focus', 'vision', 'mistake', 'bend', 'break', 'friction', 'hotter', 'fire', 'purer', 'gold', 'im', 'died', 'every', 'winter', 'survived', 'weather', 'look', 'bloom', 'tried', 'poison', 'water', 'little', 'stronger', 'light', 'room']",0.083,0.765,0.151,Positive,0.151
Katy Perry,What Makes a Woman,Smile (Fan Edition),2020-08-20,is it the way i talk sweet the way my skin is soft or how i can be a bitch make you keep your fingers crossed is it the way that i praise you the way that i please you or how fast i change my mind and get scared that i might leave you   could spend your whole life but you couldn't describe what makes a woman shes always been a perfect mystery could spend your whole life but you couldn't describe what makes a woman and that's what makes a woman to me   is it the way i cut my hair and put no makeup on i feel most beautiful doing what the fuck i want is it that my intuition is never really off i need tissues for my issues and bandaids for my heart   could spend your whole life but you couldnt describe what makes a woman she's always been a perfect mystery could spend your whole life but you couldn't describe what makes a woman and that's what makes a woman to me  post oh oh oh oh that's what makes a woman to me oh oh oh yeah yeahyeah oh oh   is it the way we keep the whole world turning in a pair of heels yeah that's what makes a woman there it is katheryn,2020.0,"['way', 'talk', 'sweet', 'skin', 'soft', 'bitch', 'make', 'keep', 'finger', 'crossed', 'praise', 'please', 'fast', 'change', 'mind', 'get', 'scared', 'might', 'leave', 'could', 'spend', 'whole', 'life', 'describe', 'woman', 'shes', 'always', 'perfect', 'mystery', 'thats', 'cut', 'hair', 'put', 'makeup', 'feel', 'beautiful', 'fuck', 'want', 'intuition', 'never', 'really', 'need', 'tissue', 'issue', 'bandaids', 'heart', 'couldnt', 'post', 'oh', 'yeah', 'yeahyeah', 'world', 'turning', 'pair', 'heel', 'katheryn']",0.068,0.806,0.126,Positive,0.126
Katy Perry,Teary Eyes,Smile (Fan Edition),2020-08-28,have you ever lost lost the light in your life have you ever left left yourself behind have you ever lied and just replied i'm fine 'cause i can see you've lost lost the light in your life  pre wanna run like your mascara winestained lips talkin' to the mirror if the sun comes up don't even care at all   just keep on dancin' with those teary eyes just keep on dancin' with those teary eyes promise one day baby they're gonna dry just keep on dancin' with those teary eyes   if love has left you with with a question mark if trust has left you fallin' in nobody's arms  pre if you wanna hide like your emotions heart can't break it's already broken if the sun comes up don't even care at all   just keep on dancin' with those teary eyes just keep on dancin' with those teary eyes promise one day baby they're gonna dry just keep on dancin' with those teary eyes  post oh oh oh oh just keep on dancin' with those teary eyes   wanna run like your mascara winestained lips talkin' to the mirror if the sun comes up don't even care at all   just keep on dancin' with those teary eyes oh just keep on dancin' with those teary eyes promise one day baby they're gonna dry just keep on dancin' with those teary eyes  post keep on dancin' oh oh keep on dancin' oh keep on dancin' oh just keep on dancin' with those teary eyes,2020.0,"['ever', 'lost', 'light', 'life', 'left', 'behind', 'lied', 'replied', 'im', 'fine', 'cause', 'see', 'pre', 'wanna', 'run', 'like', 'mascara', 'winestained', 'lip', 'talkin', 'mirror', 'sun', 'come', 'even', 'care', 'keep', 'dancin', 'teary', 'eye', 'promise', 'one', 'day', 'baby', 'theyre', 'gonna', 'dry', 'love', 'question', 'mark', 'trust', 'fallin', 'nobody', 'arm', 'hide', 'emotion', 'heart', 'cant', 'break', 'already', 'broken', 'post', 'oh']",0.087,0.828,0.085,Negative,0.087
Katy Perry,Only Love,Smile (Fan Edition),2020-08-28,only love only love only love only love   eightysix thousand four hundred seconds in a day i swear lately most of 'em have been a waste i feel 'em come and go bury my mistakes but time just goes on and on in a way  pre if i had one day left to live and if the stars went out on me the truth is yeah there's so much i'd say and do if i had nothing to lose nah nothing to lose   oh i'd call my mother and tell her i'm sorry i never call her back i'd pour my heart and soul out into a letter and send it to my dad like oh my god the time i've wasted lost in my head let me leave this world with the hate behind me and take the love instead  post give me only love only love give me only love only love   i swear sometimes i hear myself talking getting mad take shit so personal like it really matters oh am i awake am i sleepwalking tell me that it's scary how quickly i lose perspective and i react  pre if i had one day left to live and if the stars went out on me the truth is yeah there's so much i'd say and do if i had nothing to lose no nothing to lose   oh i'd call my mother and tell her i'm sorry i never call her back i'd pour my heart and soul out into a letter and send it to my dad like oh my god the time i've wasted lost in my head let me leave this world with the hate behind me and take the love instead  post give me only love only love give me only love only love no yeah give me only love only love let me leave this world with the hate behind me and take the love instead give me mmm only love only love only love only love give me only love only love only love only love only love only love only love oh no only love let me leave this world with the hate behind me oh and take the love instead   let me leave this world with the hate behind me and take the love instead give me only love only love yeah give me only love only love,2020.0,"['love', 'eightysix', 'thousand', 'four', 'hundred', 'second', 'day', 'swear', 'lately', 'em', 'waste', 'feel', 'come', 'go', 'bury', 'mistake', 'time', 'way', 'pre', 'one', 'left', 'live', 'star', 'went', 'truth', 'yeah', 'there', 'much', 'id', 'say', 'nothing', 'lose', 'nah', 'oh', 'call', 'mother', 'tell', 'im', 'sorry', 'never', 'back', 'pour', 'heart', 'soul', 'letter', 'send', 'dad', 'like', 'god', 'ive', 'wasted', 'lost', 'head', 'let', 'leave', 'world', 'hate', 'behind', 'take', 'instead', 'post', 'give', 'sometimes', 'hear', 'talking', 'getting', 'mad', 'shit', 'personal', 'really', 'matter', 'awake', 'sleepwalking', 'scary', 'quickly', 'perspective', 'react', 'mmm']",0.112,0.487,0.401,Positive,0.401
Katy Perry,Ghost,PRISM,2013-10-18,you sent a text it's like the wind changed your mind we were best friends yeah we were building a life with every kiss and every letter every promise of forever oh but you hit send and disappeared in front of my eyes   and now you're just a ghost when i look back never woulda known that you could be so cold like a stranger vanish like a vapor theres just an echo where your heart used to be now i see it clearly and theres just a pillow where your head used to sleep my visions 00 i see through you now   something has died now that i have made up my mind ill be alright ill be alright it doesnt haunt me at night 'cause every gift and every letter every promise of forever now is out of sight like you were never alive   and now you're just a ghost when i look back never woulda known that you could be so cold like a stranger vanish like a vapor theres just an echo where your heart used to be now i see it clearly and theres just a pillow where your head used to sleep my visions 00 i see through you now   now now now now now now now now now now so rest in peace ill see you on the other side   and now you're just a ghost when i look back never woulda known that you could be so cold like a stranger vanish like a vapor theres just an echo where your heart used to be now i see it clearly and theres just a pillow where your head used to sleep my visions 00 i see through you   now now now now now oh now now now now now i see through you now now now now now now now now now now now i see through you now,2013.0,"['sent', 'text', 'like', 'wind', 'changed', 'mind', 'best', 'friend', 'yeah', 'building', 'life', 'every', 'kiss', 'letter', 'promise', 'forever', 'oh', 'hit', 'send', 'disappeared', 'front', 'eye', 'ghost', 'look', 'back', 'never', 'woulda', 'known', 'could', 'cold', 'stranger', 'vanish', 'vapor', 'there', 'echo', 'heart', 'used', 'see', 'clearly', 'pillow', 'head', 'sleep', 'vision', '00', 'something', 'died', 'made', 'ill', 'alright', 'doesnt', 'haunt', 'night', 'cause', 'gift', 'sight', 'alive', 'rest', 'peace', 'side']",0.084,0.718,0.198,Positive,0.198
Katy Perry,Dance with the Devil,Witness,2017-06-09,i lost my tug of war today took my foot off of the brakes the definition of insanity is looping on repeat and expecting things to change but what comes up must hit the ground so i drink these anvils down she always comes to me highly disguised an angel whispering so many pretty shapes   it's a dance with the devil a stumbling tango it's a dance with the devil trying to borrow from tomorrow  drop it's a dance oh no oh no i don't need you oh no oh no i don't need you it's a dance oh no oh no i don't need you oh no oh no i don't need you it's a dance   just want to connect but you won't let me do it so i get altered twisted and conflicted so i casually can shoot the shit wish less was going on wish i could just throw the ball and ignore it all constantly distracted by the noise of my pingpong   it's a dance with the devil a mercurial wrestle it's a dance with the devil trying to borrow from tomorrow  drop it's a dance oh no oh no i don't need you oh no oh no i don't need you it's a dance oh no oh no i don't need you oh no oh no i don't need you it's a oh no oh no i don't need you oh no oh no i don't need you oh no oh no i don't need you oh no oh no i don't need you   but what what is it worth waking up with a crown of clouds what is it worth when my head spins out with doubt wish i could measure when the poison is pouring out oh   it's a dance oh no oh no i don't need you oh no oh no i don't need you it's a dance oh no oh no i don't need you oh no oh no i don't need you it's a dance oh no oh no i don't need you oh no oh no i don't need you it's a dance oh no oh no i don't need you oh no oh no it's a,2017.0,"['lost', 'tug', 'war', 'today', 'took', 'foot', 'brake', 'definition', 'insanity', 'looping', 'repeat', 'expecting', 'thing', 'change', 'come', 'must', 'hit', 'ground', 'drink', 'anvil', 'always', 'highly', 'disguised', 'angel', 'whispering', 'many', 'pretty', 'shape', 'dance', 'devil', 'stumbling', 'tango', 'trying', 'borrow', 'tomorrow', 'drop', 'oh', 'need', 'want', 'connect', 'let', 'get', 'altered', 'twisted', 'conflicted', 'casually', 'shoot', 'shit', 'wish', 'le', 'going', 'could', 'throw', 'ball', 'ignore', 'constantly', 'distracted', 'noise', 'pingpong', 'mercurial', 'wrestle', 'worth', 'waking', 'crown', 'cloud', 'head', 'spin', 'doubt', 'measure', 'poison', 'pouring']",0.368,0.567,0.065,Negative,0.368
Katy Perry,Act My Age,Witness,2017-06-09,i'm thirtysomething going on thirteen still a sponge to everything saucer eyes wide yeah i still believe and a sparkle in my steps smiling with my teeth  pre they say that i might lose my midas touch they also say i may become irrelevant but who the fuck are they anyway i don't care what they say   i won't act my age time is just an invention man has made no i won't act my age it's just my reflection that is out of date 'cause it's all in your attitude it's all in your point of view i won't act my age just need a little bit of peter pan and some imagination no i won't act my age   so i recommend that you lose your mind it was the only thing that was keeping me behind  pre they say curb your curiosity they also say prepare to amend your dreams but who the fuck are they anyway i don't care what they say   'cause i won't act my age time is just an invention man has made no i won't act my age it's just my reflection that is out of date 'cause it's all in your attitude it's all in your point of view i won't act my age c'mon just need a little bit of peter pan and some imagination no i won't act my age   how old would you be yeah how old would you really be if you didn't know yeah how old you really were how old would you be yeah how old would you really be if you didn't know know how old you really were hey   i won't act my age time is just an invention man has made no i won't act my age it's just my reflection that is out of date 'cause it's all in your attitude it's all in your point of view i won't act my age just need a little bit of peter pan and some imagination no i won't act my age   ohoh i won't act my age ooh yeah ooh ooh yeah ooh i won't act my age,2017.0,"['im', 'thirtysomething', 'going', 'thirteen', 'still', 'sponge', 'everything', 'saucer', 'eye', 'wide', 'yeah', 'believe', 'sparkle', 'step', 'smiling', 'teeth', 'pre', 'say', 'might', 'lose', 'midas', 'touch', 'also', 'may', 'become', 'irrelevant', 'fuck', 'anyway', 'care', 'act', 'age', 'time', 'invention', 'man', 'made', 'reflection', 'date', 'cause', 'attitude', 'point', 'view', 'need', 'little', 'bit', 'peter', 'pan', 'imagination', 'recommend', 'mind', 'thing', 'keeping', 'behind', 'curb', 'curiosity', 'prepare', 'amend', 'dream', 'cmon', 'old', 'would', 'really', 'know', 'hey', 'ohoh', 'ooh']",0.103,0.824,0.073,Negative,0.103
